3/8/2020 16:47:32,Female,No,East Asian,"Ottawa, Canada","Waterloo, Ontario",In-province student,None,"Student Council/Leadership roles, Sports, Band/Orchestra, Part-time job, DECA",6-10 hours,95+,Yes,Doctoral or Professional Degree,Yes,$200-250k,Liberalism,Atheist,Atheist,"SYDE 542, BME 487, MSCI 432, SYDE 543, BME 489, SCI 201","INTST 101, RS 121, GENE 22D (Food and Nutrition while on exchange)",0,3A,"QUT, Brisbane",None,None,,9,9,6,10,2,7,2,7,90-100,90-100,90-100,90-100,90-100,90-100,90-100,80-89,86,84,80,85,,81,87,,"Small class size, A department and faculty that cares, Living almost exclusively in E5 6004, Class gender ratio","How little ""bio"" there was",Yes,Yes,Systems Design Engineering,No,"Co-op, Reputation of Waterloo Engineering","Reputation of the program, High admission standards, It sounded interesting",Somewhat,Somewhat,No,,,,,"Yes, self-funded mostly","Yes, self-funded mostly","Yes, self-funded mostly","Yes, self-funded mostly",Other,Healthcare/biotech,Healthcare/biotech,N/A,Software (SAAS),Healthcare/biotech,Research,Design/UX,Other,N/A,PM,Other,Excellent,Outstanding,Outstanding,N/A,Outstanding,Excellent,10,19,15,,58.5,22,No,,Yes,University of Waterloo Ideas Clinic,"Waterloo, Canada",XSENSOR,"Calgary, Canada",Sunnybrook Health Sciences Centre,"Toronto, Canada",,,Credit Karma,"San Francisco, United States",St. Michael's Hospital,"Toronto, Canada","It was alright, some regrets though","Good company, met my expectations",Exceeded my expectations,N/A,Awesome workplace! Favourite Co-op.,"Good company, met my expectations","Going to the gym, Partying, Clubbing, Playing board games/cards/puzzles, Reading, Watching movies/shows, Watching Youtube videos, Listening to music, Chilling with friends, Singing, Sleeping, Baking/cooking, Traveling, Hiking, Playing sports",>4 hours,>2 hours,>6 hours,,"BME, Science, Business, Teaching","Subway, Fresh Burrito, Beertown, Jack's, Sushi 99, Ben Thanh ",0,,7,8,6,7,7,8,10,8,6,8,8,8,9,9,9,6,7,8,7,8,,Taurus,Full Time Employment,Full Time Employment,"Business, Education",Still Searching,No,,,,,,,No,No,No,,,,,,Yes,7 weeks,2 of us,Yes,"Peru, Colombia, Chile, Argentina ",5,Depends on how much money I end up making,30,"Kind, Charismatic, Similar Beliefs, Adventurous, Intelligent",2,,
3/8/2020 17:54:55,Male,No,Caucasian,"North York, Canada","New Liskeard, Canada",In-province student,None,"Sports, Part-time job",11-15 hours,90-94.9999,Yes,Doctoral or Professional Degree,Yes,$200-250k,Socialism,Atheist,Agnostic,"SYDE 372, ECE 356, ECE 358, MSCI 432, SCI 201, SE 465","INTST 101, RS 110, RS 121",0,No,,None,None,,9,8,5,10,7,9,6,7,90-100,90-100,80-89,90-100,70-79,70-79,60-69,20-29,68,70,73,71,76,68,75,,"The people, Small class size, Exposure to different disciplines, Class gender ratio",,Yes,Yes,Software Engineering,No,"Co-op, Reputation of Waterloo Engineering, High admission standards","High admission standards, Idea of combining STEM & Biology, I like making things, I don't know",No,Somewhat,No,,,,"Yes, self-funded mostly","Yes, self-funded mostly","Yes, self-funded mostly","Yes, self-funded mostly","Yes, self-funded mostly",N/A,Manufacturing,Software (SAAS),Software (SAAS),Software (SAAS),Software (SAAS),N/A,Mechanical,Software,Software,Software,Software,N/A,Excellent,Excellent,Excellent,Excellent,Outstanding,,16,18,18.5,24.14,19,No,,Yes,,,Forsch Performance,"Kitchener, Canada",Canadian Solar,"Guelph, Canada",Canadian Solar,"Guelph, Canada",Emagin Clean Technologies,"Waterloo, Canada",iWave,"Charlottetown, Canada",Awesome workplace! Favourite Co-op.,Exceeded my expectations,"Good company, met my expectations","Good company, met my expectations","Good company, met my expectations",Awesome workplace! Favourite Co-op.,"Partying, Clubbing, Playing board games/cards/puzzles, Watching movies/shows, Watching Youtube videos, Listening to music, Chilling with friends, Playing video games, Sleeping, Traveling, Watching sports, Playing sports, Fishing",>6 hours,>6 hours,> 0 hours,Intramurals,"BME, ECE, NANO","Williams, Subway, Shawarma Plus, Fresh Burrito",3,"Party, Home town, tinder",8,6,7,10,7,8,8,6,6,9,8,7,6,9,6,8,5,8,4,8,INTP,Libra (stupid question),Full Time Employment,"Full Time Employment, Another Undergraduate Program","Business, Project Management",Yes,Yes,iWave,"Charlottetown, PEI",Software,"70,000",2,No,Yes,No,No,,,,,,Yes,5 weeks,2 of us,Yes,"(Europe) Netherlands, Germany, Budapest, Iceland",5,No,26-30,"Funny, Confident, Physically Attractive, Shared Interests, Similar Beliefs, Open-Minded, Patient, Adventurous, Submissive, Intelligent, Good Career, Respectful, Independent",2,,
3/8/2020 18:23:10,Female,No,East Asian,"Shenzhen, China","Toronto, Canada",In-province student,Talented Offerings for Programs in the Sciences (TOPS ),"Band/Orchestra, Social work/Volunteering, Religious, Part-time job",6-10 hours,95+,Yes,Master's Degree,Yes,$100-150k,,Christian,Christian,"SYDE372, SYDE543, SYDE575, SYDE348, SYDE522, SYDE542","PSYCH101, PSYCH207, PHIL145, PSYCH238",2,No,,None,None,,4,9,4,8,8,6,4,3,90-100,90-100,90-100,90-100,90-100,80-89,90-100,90-100,92,86,84,89,89,85,90,,"The people, Small class size, Program reputation","How much ""engineering"" there is and how little ""biomedical"" there is in the curriculum :( ",Yes,Yes,Systems Design Engineering,No,"Co-op, Reputation of Waterloo Engineering","Idea of combining STEM & Biology, The growing BME industry, Potential for positive impact on people's lives",Somewhat,Somewhat,20-30k,,,,,,,,,Academia/ Research,Healthcare/biotech,Healthcare/biotech,Software (SAAS),Software (SAAS),Software (SAAS),"Mechanical, Research","Hardware, Research","Software, Research",Software,"Software, Research","Software, Research",Outstanding,Excellent,Outstanding,Excellent,Outstanding,Outstanding,14,14,20,24,30,30,Yes,Yes,,University of Waterloo,"Waterloo, Canada",St. Michael's Hospital,"Toronto, Canada",Synaptive Medical Inc.,"Toronto, Canada",North Inc. (Thalmic Labs),"Kitchener, Canada",Huawei Technologies Canada,"Markham, Canada",Huawei Technologies Canada,"Markham, Canada ",Exceeded my expectations,"It was alright, some regrets though","Good company, met my expectations","Worst coop, its a trap!",Awesome workplace! Favourite Co-op.,Awesome workplace! Favourite Co-op.,"Going to the gym, Playing board games/cards/puzzles, Playing an instrument(s), Watching movies/shows, Watching Youtube videos, Listening to music, Yoga, Chilling with friends, Singing, Baking/cooking, Food exploration",>2 hours,>2 hours,>4 hours,"BioMechatronics, Engineers in Medicine, Orchestra/Choir/Acapella","BME, Math, Science, Business","Sweetdreams Tea Shop, Shinwa, Subway",2,"Co-op, online",6,7,5,7,8,9,10,9,6,8,9,9,10,10,7,7,7,9,8,9,ISFJ,Taurus,Graduate Studies,Full Time Employment,Academia,Yes,Yes,,,Software,,,No,Yes,No,No,Computer Science,Research,PhD,,"En route to becoming an academic (ex IP), Industry",Yes,3 weeks,4,No,"Hungary, Austria, Czech Republic, Germany, Netherlands",5,Depends on how much money I end up making,29,"Kind, Charismatic, Shared Interests, Similar Beliefs, Patient",2,,Personal Growth
3/8/2020 20:59:58,Female,No,mixed,"Markham, Canada","Aurora, Canada",In-province student,Gifted,"Band/Orchestra, Robotics/Tech",1-5 hours,90-94.9999,Yes,Bachelor's Degree,Yes,,Liberalism,Agnostic,Christian,"SYDE 372, ECE 484, BME 450,  BME 489 (biocompatibility), ME 595","PSYCH 101, PHIL 327, ENGL 335",0,No,,None,None,,6,7,6,9,6,6,4,3,90-100,90-100,90-100,90-100,90-100,90-100,90-100,90-100,81,77,81,82,84,85,88,,"The people, Small class size, A department and faculty that cares, The professors, Design courses",It's very general for a program with such a specific name. That I wouldn't know basic lab skills by the end of the program e.g. pipetting.,Yes,Yes,Mechatronics Engineering,No,Co-op,"Family pressure, Idea of combining STEM & Biology, It sounded interesting",Somewhat,Yes,20-30k,,,,,,,,,Healthcare/biotech,Finance/ Insurance,Healthcare/biotech,Academia/ Research,Healthcare/biotech,Healthcare/biotech,Software,Software,Other,Software,"Software, Hardware, Design/UX","Software, Hardware, Design/UX",Excellent,Outstanding,Outstanding,Excellent,Excellent,Outstanding,18,21,22,15,24,24,Yes,Yes,,OICR,"Toronto, Canada",Great West Life,"Toronto, Canada",Synaptive,"Toronto, Canada",UW - EMRG lab,"Waterloo, Canada",ChipCare,"Toronto, Canada",ChipCare,"Toronto, Canada",Exceeded my expectations,"Worst coop, its a trap!","Good company, met my expectations","Good company, met my expectations",Awesome workplace! Favourite Co-op.,Awesome workplace! Favourite Co-op.,"Climbing, Playing board games/cards/puzzles, Reading, Watching movies/shows, Watching Youtube videos, Listening to music, Dancing, Chilling with friends, Playing video games, Singing, Sleeping, Playing sports",> 0 hours,>6 hours,> 0 hours,"BioMechatronics, Dance clubs, Humans vs. Zombies, Judo","BME, TRON, Math","Williams, Chen's, Kabob Hut, Harvey's, Sweetdreams Tea Shop, Campus Pizza, Shinwa, Nuri Village, iPotato, Baba Grill, Pita Factory, Ken Sushi",2,"highschool, judo",5,7,10,10,7,9,9,9,5,8,6,8,10,10,8,8,8,9,8,8,INFJ,Pisces,Full Time Employment,"Graduate Studies, Full Time Employment, Startup",No,Still Searching,No,,,,,,,No,No,No,,,,,,Yes,2 weeks,7,Yes,"Spain, France",5,No,26,"Funny, Open-Minded, Thoughtful, Reliable, Independent",2,,
3/9/2020 11:36:39,Female,No,East Asian and South Asian,"North York, Canada","Thornhill, Ontario",In-province student,None,"Social work/Volunteering, Religious, Part-time job",6-10 hours,95+,Yes,Master's Degree,Yes,$150-200k,Liberalism,Catholic,Catholic,"STAT 332, BME 487, SYDE 543, BME 489, PSYCH 261, SYDE 522","PSYCH 101, ENGL 335, CLAS 201",1,No,,None,None,,8,8,7,10,6,6,4,7,90-100,90-100,90-100,90-100,90-100,90-100,90-100,80-89,84.09,83.42,82.27,81.08,82.64,80.46,88.8,,"The people, Small class size, A department and faculty that cares, Group work, Socials (Biowasted, Coffee House, Potlucks)",How little I feel like I have learned coming out of it. ,Yes,Yes,Systems Design Engineering,No,"Co-op, High admission standards","Small class size, Reputation of the program, High admission standards, I don't know",No,No,No,,,,"Yes, self-funded mostly","Yes, self-funded mostly","Yes, self-funded mostly",,,"Healthcare/biotech, Other",Software (SAAS),Consulting,Healthcare/biotech,Healthcare/biotech,Academia/ Research,"Mechanical, Research, Business",Software,Research,QA/Testing,"QA/Testing, Research",Research,Excellent,Excellent,Outstanding,Outstanding,Excellent,Very Good,5.35,16.5,18,21,24,20,No,No,Yes,"BETS program: Neurecall (now Syngli), Acorn Cryotech, Pitstop","Waterloo, Canada",Quanser Inc.,"Markham, Canada",HumanSystems Inc.,"Guelph, Canada",Focal Healthcare,"Toronto, Canada",Focal Healthcare,"Toronto, Canada",UTC and UW,"Compiegne, France","It was alright, some regrets though","Good company, met my expectations","Good company, met my expectations",Exceeded my expectations,"Good company, met my expectations","It was alright, some regrets though","Partying, Watching movies/shows, Watching Youtube videos, Listening to music, Dancing, Chilling with friends, Sleeping, Playing sports, Food exploration",> 0 hours,0,>8 hours,Varsity Sports,"BME, Science, Applied Health Science, Arts, Environemt","Williams, Sweetdreams Tea Shop, Shawarma Plus, iPotato, Baba Grill, Fresh Burrito",2,"Mutual friends (first one), sports team (second one)",7,6,5,5,4,8,9,7,2,7,8,6,5,5,7,4,3,7,4,6,INFP-T Mediator,Scorpio,Full Time Employment,"Graduate Studies, Full Time Employment","Law, Product Design",No,No,,,,,,,No,No,No,,,,,,Yes,2 weeks,2 of us,No,"Ireland, Scotland",4,No,25,"Funny, Open-Minded, Patient, Thoughtful, Respectful",4,1-2 years,"Travel, Personal Growth, New Experiences"
3/9/2020 16:09:48,Female,No,East Asian,"Los Angeles, California","Coquitlam, Canada",Out-of-province student,"Advanced Placement (AP), Gifted","Student Council/Leadership roles, Sports, Band/Orchestra, Social work/Volunteering",6-10 hours,95+,Yes,Doctoral or Professional Degree,Yes,$50-100k,Conservatism,Agnostic,Agnostic,"SYDE 372, SYDE 556, SYDE 544, SYDE 575, ECE 484, KIN 406","PSYCH 257, PSYCH 232, GER 101, GERON 218",1,No,,None,None,,6,8,6,7,8,7,8,9,90-100,90-100,90-100,90-100,90-100,80-89,90-100,90-100,88,85,84,84,85,87,86,,"The people, Small class size, Exposure to different disciplines, Living almost exclusively in E5 6004, Class gender ratio","Disorganization of curriculum and courses, lack of depth in course content, incredibly high similarity to SYDE, lack of BME-specific jobs for undergraduate students, number of design courses",No,Yes,Mechatronics Engineering,No,"Co-op, Reputation of Waterloo Engineering","Small class size, Idea of being a guinea pig for a new program, Idea of combining STEM & Biology, The growing BME industry, It sounded interesting",Yes,Somewhat,30-40k,,,,"Yes, self-funded mostly","Yes, self-funded mostly","Yes, self-funded mostly","Yes, self-funded mostly","Yes, self-funded mostly",Finance/ Insurance,"Software (SAAS), Academia/ Research",Healthcare/biotech,"Healthcare/biotech, Academia/ Research","Software (SAAS), Other",Healthcare/biotech,IT,"Software, PM",Software,"Software, Research","Software, PM",Software,Outstanding,Outstanding,Outstanding,Outstanding,Outstanding,Outstanding,16.25,18.74,20.8,20,33.53,56.88,No,,Yes,LOGiQ3,"Toronto, Canada",Ontario Institute for Cancer Research,"Toronto, Canada",Intellijoint Surgical,"Waterloo, Canada",The Hospital for Sick Children,"Toronto, Canada",Cognite,"Oslo, Norway",Athos,"Redwood City, United States",Exceeded my expectations,Exceeded my expectations,Exceeded my expectations,"Good company, met my expectations",Awesome workplace! Favourite Co-op.,"Good company, met my expectations","Climbing, Going to the gym, Partying, Playing board games/cards/puzzles, Reading, Listening to music, Yoga, Dancing, Chilling with friends, Baking/cooking, Traveling, Hiking",>8 hours,>2 hours,>4 hours,"Intramurals, Orientation Week, Dance clubs","BME, TRON, SE, MGMT, NANO, Math, Science, Business, Other Programs","Williams, Ken Sushi",1,"University, in class",6,7,6,7,4,7,9,4,3,8,7,7,8,5,3,8,8,8,6,7,ENFP,Aries,Full Time Employment,"Graduate Studies, Full Time Employment","Business, Project Management",Yes,No,Microsoft,"Seattle, United States",Software,214500,2,No,Yes,No,No,MBA,Course,Masters,,,Maybe,6 weeks,2 of us,No,,12,Depends on how much money I end up making,27,"Kind, Charismatic, Physically Attractive, Intelligent, Reliable",2,5,"Money, New Experiences, More Interesting Job Opportunities"
3/9/2020 22:16:53,Female,No,South Asian,"Morristown, USA","Oakville, Canada",In-province student,None,"Band/Orchestra, Theatre, Social work/Volunteering",1-5 hours,90-94.9999,Yes,Master's Degree,Yes,$100-150k,Socialism,Muslim,Muslim,"SYDE 372, SYDE 542, SYDE 522, MSCI 436, MSCI 432, SYDE 543","MSCI 211, CLAS 104, RS 110",1,No,,None,None,,9,10,2,10,4,7,4,3,70-79,70-79,90-100,90-100,90-100,90-100,60-69,80-89,76,70,87,83,82,77,84,,"A department and faculty that cares, Sense of duty towards the well being of the public, The professors, Program reputation, Class gender ratio",BME is SYDE in disguise. US employers have a hard time understanding that. ,Yes,Yes,No,No,"Co-op, Reputation of Waterloo Engineering","Reputation of the program, High admission standards, Idea of combining STEM & Biology, It sounded interesting, Potential for positive impact on people's lives",Somewhat,Somewhat,20-30k,,,"Yes, self-funded mostly","Yes, self-funded mostly","Yes, self-funded mostly","Yes, self-funded mostly","Yes, self-funded mostly","Yes, self-funded mostly",Healthcare/biotech,Software (SAAS),Healthcare/biotech,Healthcare/biotech,Healthcare/biotech,,QA/Testing,Software,Software,PM,PM,,Outstanding,Outstanding,Excellent,Outstanding,Outstanding,,17.5,19,22,45.5,45.5,,No,,,Focal Healthcare ,"Toronto, Canada",Alert Labs,"Kitchener, Canada ",Unyte Health,"Toronto, Canada",Vineti,"San Francisco, USA",Vineti ,"San Francisco, USA",,,"Good company, met my expectations",Exceeded my expectations,"Worst coop, its a trap!",Awesome workplace! Favourite Co-op.,Awesome workplace! Favourite Co-op.,N/A,"Going to the gym, Playing board games/cards/puzzles, Reading, Watching movies/shows, Listening to music, Yoga, Chilling with friends, Playing video games, Sleeping, Baking/cooking, Traveling, Hiking, Food exploration",>2 hours,>2 hours,> 0 hours,Engineers in Medicine,"BME, SYDE, CHEM, Science, Business","Williams, Kabob Hut, Subway",1,On campus,10,8,8,8,8,9,10,9,1,10,10,7,8,8,3,8,10,8,4,8,,Gemini,Full Time Employment,"Graduate Studies, Full Time Employment, Startup",No,Still Searching,No,,,,,,,Yes,No,No,,,,,,No,,,,,3,Yes,22,"Shared Interests, Similar Beliefs, Thoughtful, Respectful, Motivated",4,5-10,"Money, Family / Relationship, More Interesting Job Opportunities, Climate"
3/10/2020 11:31:37,Female,No,Caucasian,"Owen Sound, Canada","Owen Sound, Canada",In-province student,Language Immersion,"Student Council/Leadership roles, Band/Orchestra, Theatre, Religious",6-10 hours,95+,No,Master's Degree,No,$50-100k,Liberalism,Christian,Christian,"GENE 499, BME 450, SYDE 543, BME 488, BME 489, SCI 201","MUSIC 140, MUSIC 246, HIST 207",0,No,,None,None,,7,8,5,10,6,8,7,8,90-100,90-100,90-100,90-100,90-100,90-100,90-100,90-100,78,76.08,80.09,77.42,85.36,80.09,86.8,,"The people, Small class size, Exposure to different disciplines, Class gender ratio, Socials (Biowasted, Coffee House, Potlucks)",the pure breadth of the field,Yes,I still don't know,No,AHS,"Co-op, Reputation of Waterloo Engineering","Idea of combining STEM & Biology, It sounded interesting, I like making things, Potential for positive impact on people's lives",No,Yes,20-30k,"Yes, self-funded mostly","Yes, self-funded mostly","Yes, self-funded mostly","Yes, self-funded mostly","Yes, self-funded mostly","Yes, self-funded mostly","Yes, self-funded mostly","Yes, self-funded mostly",Academia/ Research,Other,Healthcare/biotech,Academia/ Research,Healthcare/biotech,Healthcare/biotech,"Design/UX, Research","QA/Testing, PM, Design/UX, Research","QA/Testing, Mechanical",Research,"QA/Testing, Mechanical","QA/Testing, Mechanical",Excellent,Excellent,Outstanding,Excellent,Very Good,Very Good,14,20,20,10,23,23,Yes,Yes,No,University of Waterloo Engineering Ideas Clinic,"Waterloo, Canada",GoFleet,"Mississauga, Canada",Laborie Medical,"Mississauga, Canada",Universite de Technologie de Compiegne,"Compiegne, France",Baylis Medical,"Mississauga, Canada",Baylis Medical,"Mississauga, Canada","It was alright, some regrets though","Worst coop, its a trap!","Good company, met my expectations","It was alright, some regrets though",Awesome workplace! Favourite Co-op.,Awesome workplace! Favourite Co-op.,"Going to the gym, Playing board games/cards/puzzles, Reading, Playing an instrument(s), Watching movies/shows, Watching Youtube videos, Listening to music, Dancing, Chilling with friends, Singing, Sleeping, Baking/cooking, Traveling, Hiking",>6 hours,>6 hours,>4 hours,Residence Staff (Don/Residence Ambassador),"BME, SE, NANO, Science, Applied Health Science, Arts, Business",,4,dating apps,7,9,6,9,9,7,4,10,6,7,4,5,8,9,6,9,8,5,6,7,ENFP,libra,Full Time Employment,"Graduate Studies, Full Time Employment, Medical School, Another Undergraduate Program","Medicine, Education, Theater, Product Design",Still Searching,Yes,,,,,,,Yes,No,No,,,,,,Maybe,3 weeks,3,No,scandinavia maybe,6,No,28,"Funny, Similar Beliefs, Thoughtful, Social, Reliable",2,,
3/15/2020 13:03:43,Female,No,Caucasian,"St. Petersburg, Russia","Richmond Hill, Ontario",In-province student,Gifted,"Sports, Robotics/Tech, Theatre, Social work/Volunteering, Part-time job, Model UN",11-15 hours,95+,Yes,Master's Degree,Yes,$200-250k,Liberalism,Agnostic,Christian,"SYDE 372, MSCI 446, SYDE 575, SYDE 334, SYDE 522, SYDE 544","PSYCH 101, HIST 263, HIST 236, ",2,No,,None,None,,2,5,3,7,8,8,3,7,90-100,90-100,90-100,90-100,90-100,80-89,90-100,90-100,87.73,80,83.73,82.33,82.64,77.18,82.8,,"The people, Small class size, Exposure to different disciplines, Group work, Class gender ratio",I was surprised by the quantity of group work,No,Yes,No,No,"Co-op, Lots of my friends went here","Small class size, High admission standards, Idea of combining STEM & Biology, It sounded interesting",Somewhat,Yes,No,,,,,,"Yes, self-funded mostly","Yes, self-funded mostly","Yes, self-funded mostly","Healthcare/biotech, Academia/ Research",Healthcare/biotech,Hardware,Hardware,Software (SAAS),Software (SAAS),Software,"Software, Hardware",Software,Software,Software,Software,Excellent,Outstanding,Excellent,Outstanding,Outstanding,Very Good,17,18,19,56.5,94.9,70.1,No,No,Yes,Ontario Institute for Cancer Research,"Toronto, Canada",Synaptive Medical,"Toronto, Canada",Thalmic Labs (North),"Kitchener, Canada",ON Semiconductor,"San Jose, USA",Facebook,"Seattle, USA",Asana,"San Francisco, USA","Good company, met my expectations",Exceeded my expectations,Exceeded my expectations,"It was alright, some regrets though",Awesome workplace! Favourite Co-op.,Awesome workplace! Favourite Co-op.,"Climbing, Partying, Playing board games/cards/puzzles, Reading, Watching movies/shows, Yoga, Chilling with friends, Hiking",>6 hours,>2 hours,>4 hours,"BioMechatronics, Intramurals, Orientation Week, Orchestra/Choir/Acapella, Humans vs. Zombies","BME, TRON, SE, Math","Williams, Sweetdreams Tea Shop, Shawarma Plus, Pita Factory",1,frosh week,4,7,6,8,6,8,8,4,6,9,6,8,4,3,4,8,4,8,6,9,ENTJ,Aquarius,Full Time Employment,"Graduate Studies, Full Time Employment",Project Management,Yes,Yes,Facebook,"Seattle, USA",Software,"325,275",5,No,Yes,No,No,,,,,,Yes,4 weeks,7,Yes,"Spain, France, Belgium",5,No,27,"Caring, Intelligent, Thoughtful, Reliable, Motivated",2,10,"Money, New Experiences, More Interesting Job Opportunities"
3/15/2020 14:56:03,Male,No,Didn't have box for ,"Jakarta, Indonesia","Mississauga, Canada",In-province student,Language Immersion,Sports,1-5 hours,95+,Yes,Bachelor's Degree,Yes,$150-200k,Communism,Catholic,Catholic,"SYDE 322, ECE 356, SYDE 575, SCI 201, SCI 250","MUSIC 140, PHIL 110B, RS 121",0,No,,None,None,,3,6,3,9,5,6,7,4,90-100,90-100,80-89,90-100,70-79,50-59,50-59,10-19,91,82,89,82,88,84,83,88,"The people, Small class size, A department and faculty that cares, The professors",the surprising lack of biology courses in the core curriculum,Yes,Yes,Software Engineering,No,"Co-op, Reputation of Waterloo Engineering, High admission standards","Idea of being a guinea pig for a new program, Reputation of the program, Idea of combining STEM & Biology, The growing BME industry, It sounded interesting",No,Somewhat,No,,,,"Yes, self-funded mostly","Yes, self-funded mostly","Yes, self-funded mostly","Yes, self-funded mostly","Yes, self-funded mostly",Healthcare/biotech,Healthcare/biotech,"Healthcare/biotech, Software (SAAS)",Software (SAAS),Software (SAAS),Software (SAAS),QA/Testing,"Research, Business",Software,"Software, Design/UX",Software,Software,Outstanding,Outstanding,Excellent,Outstanding,Outstanding,Outstanding,12,16,27,21,70.2,78,Yes,No,,SeamlessMD,"Toronto, Canada",BioIntegral Surgical,"Mississauga, Canada",Think Research,"Toronto, Canada",PaddleHR,"Toronto, Canada",Splunk Inc,"San Francisco, United States",Splunk Inc,"San Francisco, United States",Exceeded my expectations,"Worst coop, its a trap!",Exceeded my expectations,"It was alright, some regrets though",Awesome workplace! Favourite Co-op.,Awesome workplace! Favourite Co-op.,"Climbing, Going to the gym, Playing an instrument(s), Watching movies/shows, Watching Youtube videos, Sleeping, Traveling, Hiking",>4 hours,>2 hours,>4 hours,,"BME, SE, Environemt, Other Programs","Shawarma Plus, Mel's Diner, Izna",,,1,1,1,1,1,1,1,1,1,8,1,1,1,1,1,1,7,7,1,1,bruh,bigger bruh moment,Full Time Employment,Medical School,Medicine,Yes,Yes,Splunk Inc,San Francisco,Software,221000,2,No,Yes,Yes,No,,,,,,Maybe,5 weeks,3,Yes,"Japan, South Korea, Taiwan, California, Washington State",6,No,,,,probably forever,"Travel, Money, Personal Growth, Family / Relationship, New Experiences, More Interesting Job Opportunities, Climate"
