5/9/2020 12:30:01,Non-binary,Yes,Caucasian,"Toronto, Canada","Markham, Canada",In-province student,"Advanced Placement (AP), Gifted","Student Council/Leadership roles, Sports, Theatre, Part-time job",25+ hours,95+,Yes,Master's Degree,No,$300k+,Socialism,Agnostic,Agnostic,"Neuroscience (equivalent on exchange), CS 486 Intro to AI, ECE 356 Databases, ECE 358 Computer Networks, ECE 484 Digital Controls, SYDE 575 Image Processing, BIOL 239 Genetics","PHIL 221 Ethics, Music Production (equivalent on exchange), RS 121 Evil",1,3A,"Queensland University of Technology, Australia",None,None,No,10,9,4,10,1,8,7,6,90-100,80-89,60-69,60-69,20-29,60-69,20-29,10-19,90,90,83,85,,80,80,78,"The people, Small class size, A department and faculty that cares, Exposure to different disciplines, Living almost exclusively in E5 6004","I was surprised by how disinterested I was in the Biology side, and how grateful therefore I was for the exposure to a variety of engineering disciplines ",Yes,Yes,Systems Design Engineering,No,"Co-op, Reputation of Waterloo Engineering","High admission standards, Idea of combining STEM & Biology, It sounded interesting, I like making things",Somewhat,No,No,,,,,,,"Yes, self-funded mostly","Yes, self-funded mostly","Healthcare/biotech, Academia/ Research","Healthcare/biotech, Software (SAAS), Hardware","Healthcare/biotech, Hardware, Manufacturing",N/A,Software (SAAS),Software (SAAS),Research,"QA/Testing, Software","Hardware, Mechanical, Research, Other",,Software,Software,Outstanding,Outstanding,Outstanding,N/A,Excellent,Outstanding,12.5,18.75,21.25,,86,45,No,,Yes,"Vision and Image Processing Lab, UWaterloo","Waterloo, Canada",Synaptive Medical,"Toronto, Canada",P&P Optica,"Waterloo, Canada",,,Lyft,"Seattle, USA",Branch Metrics,"Redwood City, USA",Exceeded my expectations,"It was alright, some regrets though","It was alright, some regrets though",N/A,"Good company, met my expectations",Awesome workplace! Favourite Co-op.,"Climbing, Going to the gym, Partying, Clubbing, Playing board games/cards/puzzles, Playing an instrument(s), Watching movies/shows, Listening to music, Chilling with friends, Traveling, Hiking, Watching sports, Playing sports",>15 hours,>4 hours,>10 hours,"BioMechatronics, Intramurals, Varsity Sports, Orientation Week, EngSoc, EngPlay","BME, SYDE, TRON, ECE, NANO, CIVIL/GEO/ENVIRO, Science, Applied Health Science, Environemt, Business, Mech Eng (not listed)","Williams, Harvey's, Sweetdreams Tea Shop, East Side Marios, Subway, Lazeez, Molly Bloom's, Baba Grill, Fresh Burrito, Mel's Diner",4,"Through engineering socials, through rugby or rugby friends",9,9,7,9,7,9,10,7,7,10,10,7,7,9,4,8,7,9,4,7,INTJ,Cancer,Full Time Employment,"Graduate Studies, Full Time Employment, Startup","Academia, Theater, Project Management",Yes,Yes,Branch Metrics,"Redwood City (but I am working remote for now, and will eventually move to the Seattle office instead)",Software,239549,3,No,Yes,No,No,,,,,,Yes,6 weeks,2 of us,Yes,"Netherlands, Germany, Czech Republic, Hungary, Croatia",8,Yes,28,"Funny, Physically Attractive, Open-Minded, Thoughtful, Independent",3,3,"Money, New Experiences, More Interesting Job Opportunities, Climate"
5/9/2020 14:55:57,Female,No,East Asian,"Mississauga, Canada","Mississauga, Canada",In-province student,International Baccalaureate (IB),"Student Council/Leadership roles, Sports, Band/Orchestra, Robotics/Tech, Social work/Volunteering",16-20 hours,95+,Yes,Bachelor's Degree,Yes,$150-200k,Liberalism,Agnostic,Agnostic,"SYDE 372, SYDE 334, MSCI 432,  SYDE 531, SYDE 522, MSCI 446","ENGL 101B, ECON 101",2,No,,None,None,,7,7,3,9,7,7,10,7,90-100,80-89,60-69,80-89,60-69,60-69,60-69,60-69,87.64,79.33,80.54,83.5,84.46,81.73,91.6,95.67,"The people, Small class size, Sense of duty towards the well being of the public, Class gender ratio, Socials (Biowasted, Coffee House, Potlucks)","The superhuman people, though the program is not as cool as I thought it would be.",Yes,No,Software Engineering,Math,"Co-op, Reputation of Waterloo Engineering, High admission standards","Pre-med, High admission standards, Idea of combining STEM & Biology, The growing BME industry, It sounded interesting",Somewhat,Somewhat,No,,,,,,,,,Software (SAAS),Healthcare/biotech,Software (SAAS),Software (SAAS),Software (SAAS),Software (SAAS),Software,QA/Testing,Software,Software,Software,Software,Outstanding,Excellent,Excellent,Excellent,Excellent,Outstanding,17,34,23,25,27,60,No,,Yes,D+H Limited,"Mississauga, Canada",Edwards Lifesciences,"Irvine, USA",Dematic,"Waterloo, Canada",Teledyne DALSA,"Waterloo, Canada",Bell Canada,"Toronto, Canada",Ultimate Software,"San Francisco, USA","Good company, met my expectations","Good company, met my expectations","Worst coop, its a trap!","It was alright, some regrets though",Exceeded my expectations,Awesome workplace! Favourite Co-op.,"Going to the gym, Partying, Clubbing, Playing board games/cards/puzzles, Reading, Playing an instrument(s), Watching movies/shows, Watching Youtube videos, Listening to music, Yoga, Dancing, Chilling with friends, Singing, Sleeping, Baking/cooking, Traveling, Hiking, Playing sports, Volunteering",>10 hours,>6 hours,>4 hours,"BioMechatronics, Dance clubs","BME, SYDE, TRON, Math, Science, Applied Health Science","Williams, Ken Sushi",4,"Music Room, Bomber,, Tinder, Bonfire",4,9,7,9,5,8,9,9,9,9,8,9,9,8,7,10,6,10,6,9,ENFJ,Aquarius,Graduate Studies,"Graduate Studies, Full Time Employment, Startup",Machine Learning Researcher,No,No,,,,,,,Yes,No,No,Computer Science,Research,Masters,University of Toronto,I don't know...,Yes,8 weeks,2 of us,No,Europe,10,Depends on how much money I end up making,28,"Kind, Funny, Similar Beliefs, Open-Minded, Intelligent",2,10,"Travel, Money, Personal Growth, Family / Relationship, New Experiences, More Interesting Job Opportunities, Climate"
5/12/2020 18:05:27,Male,No,Caucasian,"Hamilton, Canada","Hamilton, Canada",In-province student,None,"Sports, Band/Orchestra, Social work/Volunteering, Religious, Part-time job",16-20 hours,95+,No,Less than High School,No,$0-50k,Liberalism,Catholic,Catholic,"ECE 222, ECE 340, ECE 444, MTE420, ECE 637, ECE 224","BET 100, MUSIC 140, BET 320, ECON 101",0,No,,None,None,,8,10,6,6,7,7,4,4,90-100,90-100,90-100,90-100,90-100,90-100,90-100,90-100,81,77,83,81,88,90,86,87,"The people, Small class size",,Yes,Yes,Mechatronics Engineering,No,Co-op,Idea of combining STEM & Biology,Somewhat,No,No,"Yes, self-funded mostly",,"Yes, self-funded mostly","Yes, self-funded mostly","Yes, self-funded mostly","Yes, self-funded mostly","Yes, self-funded mostly","Yes, self-funded mostly",Manufacturing,Healthcare/biotech,Hardware,Hardware,Hardware,Hardware,Mechanical,Software,Hardware,Hardware,Hardware,Hardware,Excellent,Outstanding,Excellent,Excellent,Excellent,Excellent,16,20,21,28,60,59,No,,Yes,ARaymond,"Hamilton, Canada",Laborie,"Mississauga, Canada",Swift Labs,"Waterloo, Canada",Nuvation,"Waterloo, Canada",Nuvation,"Waterloo, Canada",Apple,"Cupertino, USA","Good company, met my expectations","Good company, met my expectations","Good company, met my expectations","Good company, met my expectations","Good company, met my expectations",Awesome workplace! Favourite Co-op.,"Climbing, Going to the gym, Partying, Playing board games/cards/puzzles, Watching movies/shows, Watching Youtube videos, Listening to music, Chilling with friends, Playing video games, Hiking, Watching sports, Playing sports",>2 hours,>2 hours,>2 hours,Orientation Week,"BME, TRON",,1,,5,7,7,8,6,8,9,9,,,8,8,7,8,7,8,7,9,7,9,,Cancer,Full Time Employment,"Graduate Studies, Full Time Employment",No,Yes,No,,,Hardware,,,No,Yes,No,No,,,,,,Yes,2 weeks,5,Yes,Iceland,10,No,29,"Kind, Funny, Physically Attractive, Intelligent, Respectful, Reliable",2,5,More Interesting Job Opportunities
5/14/2020 10:42:26,Female,No,East Asian,Hong Kong,"Toronto, Canada",In-province student,Advanced Placement (AP),"Student Council/Leadership roles, Sports, Band/Orchestra, Social work/Volunteering",16-20 hours,90-94.9999,No,Bachelor's Degree,No,$100-150k,Liberalism,Christian,Christian,"SYDE 372, BME 450, BME 487, BME 488, BME 489, CIVE 460","PSYCH 101, ECON 101, GER 102, MUSIC 246",1,No,,None,None,,8,10,6,9,9,8,6,7,90-100,90-100,90-100,90-100,90-100,90-100,90-100,90-100,77.64,71.83,79.27,82.42,79.36,80.82,86.8,88.2,"Small class size, A department and faculty that cares, The curriculum, Exposure to different disciplines, Class gender ratio",,Yes,Yes,No,No,"Co-op, Reputation of Waterloo Engineering","The curriculumn, Reputation of the program, Idea of combining STEM & Biology, It sounded interesting, Potential for positive impact on people's lives",Somewhat,Somewhat,No,,,,,,,,,Other,Academia/ Research,Healthcare/biotech,N/A,Healthcare/biotech,Healthcare/biotech,Other,Research,Business,N/A,Business,Business,Excellent,Outstanding,Outstanding,N/A,Excellent,Outstanding,16,18,9,0,13,13,Yes,Yes,,Epson Canada,"Markham, Canada",University of Waterloo,"Waterloo, Canada",IDS Medical Systems (Hong Kong) Co. Ltd,Hong Kong,,,Philips Healthcare,"Boeblingen, Germany",Philips Healthcare,"Boeblingen, Germany","Good company, met my expectations",Awesome workplace! Favourite Co-op.,"Good company, met my expectations",N/A,Awesome workplace! Favourite Co-op.,Awesome workplace! Favourite Co-op.,"Climbing, Watching movies/shows, Watching Youtube videos, Listening to music, Baking/cooking",>10 hours,>4 hours,> 0 hours,"BioMechatronics, Intramurals, Orientation Week, Humans vs. Zombies",BME,"Williams, Subway, Ken Sushi",1,Hong Kong,9,7,7,7,8,8,8,8,1,7,7,5,7,7,9,4,5,8,7,6,ENFJ-T,Libra,Graduate Studies,"Graduate Studies, Full Time Employment",Not sure,No,No,,,,,,,No,No,No,Systems Design Engineering,Research,Masters,University of Waterloo,I don't know...,Maybe,6 weeks,3,No,"Hong Kong, Japan",7,Depends on how much money I end up making,29,"Physically Attractive, Shared Interests, Similar Beliefs, Open-Minded, Respectful",,,"New Experiences, More Interesting Job Opportunities"
5/14/2020 13:30:16,Male,No,Black or African American,"Riyadh, Saudi Arabia","Hamilton, Canada",In-province student,None,Sports,25+ hours,95+,Yes,Doctoral or Professional Degree,No,$0-50k,Socialism,Agnostic,Muslim,"ECE 252, ECE 459","PSYCH 101, SR101L",1,3B,"NTU, Singapore",None,None,,8,10,6,8,6,3,4,4,90-100,90-100,80-89,90-100,80-89,10-19,50-59,50-59,80,73,84,85,86,80,84,86,"Small class size, A department and faculty that cares",How interdisciplinary it was,Yes,Yes,Computer Engineering,No,Co-op,"High admission standards, Idea of combining STEM & Biology, The growing BME industry",No,Somewhat,20-30k,,,,,,,"Yes, self-funded mostly","Yes, self-funded mostly","Healthcare/biotech, Software (SAAS)","Healthcare/biotech, Software (SAAS)","Healthcare/biotech, Software (SAAS)","Hardware, Other","Hardware, Academia/ Research","Software (SAAS), Hardware","Software, Design/UX",QA/Testing,"Software, Hardware","Software, Hardware","Software, Hardware","Software, Hardware",Outstanding,Excellent,Outstanding,Outstanding,Excellent,Excellent,21.25,20,20,50,75,75,No,,Yes,Medlantis,"Toronto, Canada",Modus,"London, Canada",Laborie ,"Toronto, Canada",Athos,"Redwood City, United States of America",Samsung Research America,"Mountain View, United States of America",Facebook,"Seattle, United States of America",Awesome workplace! Favourite Co-op.,"It was alright, some regrets though","Good company, met my expectations",Awesome workplace! Favourite Co-op.,"Good company, met my expectations",Awesome workplace! Favourite Co-op.,"Partying, Clubbing, Playing board games/cards/puzzles, Chilling with friends, Watching sports, Playing sports",>15 hours,>2 hours,>2 hours,"BioMechatronics, Engineers in Medicine, Intramurals",BME,"Subway, Shawarma Plus, iPotato",0,,6,8,7,7,6,8,10,8,2,10,6,6,10,8,10,7,7,10,7,10,,Scorpio,"Full Time Employment, Startup","Full Time Employment, Startup",Project Management,Yes,Yes,Facebook,"Seattle, United States of America",Software,"340,000",2,No,No,No,No,,,,,,,,,,,4,No,30,"Kind, Confident, Caring, Motivated, Independent",,,"Money, Personal Growth, New Experiences, More Interesting Job Opportunities"
5/16/2020 14:13:27,Female,No,South Asian,"Karachi, Pakistan","Karachi, Pakistan",International student,GCE A levels (Cambridge International Exams),"Student Council/Leadership roles, Social work/Volunteering",1-5 hours,95+,Yes,College Degree,No,$0-50k,Liberalism,Muslim,Muslim,"SYDE 533, BME 450, SYDE 348, SYDE 542, BME 488, AMATH 382","BET 320, HIST 207, MUSIC 140",2,No,,None,None,,8,10,5,8,5,6,5,6,70-79,50-59,90-100,90-100,90-100,90-100,90-100,90-100,78,74,86,90,89,87,88,92,"The people, Small class size, A department and faculty that cares, Living almost exclusively in E5 6004, Group work, Design courses, Socials (Biowasted, Coffee House, Potlucks)",How kind and caring the community was ,No,Yes,Systems Design Engineering,No,"Co-op, Reputation of Waterloo Engineering","Idea of combining STEM & Biology, The growing BME industry, It sounded interesting",No,Somewhat,20-30k,,,,,,,"Yes, self-funded mostly",,Finance/ Insurance,Software (SAAS),Healthcare/biotech,Healthcare/biotech,Software (SAAS),Software (SAAS),Business,QA/Testing,Software,Software,Software,PM,Excellent,Outstanding,Outstanding,Outstanding,Excellent,Outstanding,21,23,16,24,31,46,No,,Yes,,,,,,,,,,,,,"Worst coop, its a trap!","Good company, met my expectations","It was alright, some regrets though","It was alright, some regrets though","Good company, met my expectations",Awesome workplace! Favourite Co-op.,"Partying, Watching movies/shows, Listening to music, Yoga, Chilling with friends, Singing",> 0 hours,> 0 hours,>2 hours,"Engineers Without Borders, BluePrint","BME, SYDE, Math","Williams, Kabob Hut, Harvey's, Sweetdreams Tea Shop, East Side Marios, Shinwa, Subway, Shawarma Plus, Ken Sushi",,,4,9,2,8,3,9,5,8,2,9,8,6,3,8,2,8,2,8,1,9,,Aries/Pieces,Full Time Employment,Graduate Studies,,Yes,Yes,Microsoft,Vancouver,Project Management,110000,5,No,No,No,No,,,,,,Yes,2 weeks,3,Yes,Europe,10,Yes,26,"Kind, Funny, Charismatic, Physically Attractive, Similar Beliefs",2,3,Visa Issues
5/18/2020 8:56:38,Male,No,Caucasian,"Kitchener, Ontario","Waterloo, Ontario",In-province student,None,"Sports, Part-time job",16-20 hours,95+,Yes,Bachelor's Degree,No,$150-200k,Liberalism,Atheist,Atheist,"BME 487, SYDE 372, SYDE 575, PSYCH 261, SYDE 552, SYDE 556, BIOL 239","PSYCH 101, FR 192B, APPLS 301, ENGL 306A",3,No,,None,None,,6,6,7,8,6,10,8,9,70-79,70-79,90-100,90-100,70-79,40-49,70-79,90-100,91,88,89,90,87,84,89,89,"The people, Small class size, A department and faculty that cares, Exposure to different disciplines, Socials (Biowasted, Coffee House, Potlucks)",,Yes,Yes,No,No,Reputation of Waterloo Engineering,"The curriculumn, Idea of combining STEM & Biology, It sounded interesting, Potential for positive impact on people's lives",Yes,Yes,No,"Yes, self-funded mostly","Yes, self-funded mostly",,,,,,,"Healthcare/biotech, Software (SAAS)",Academia/ Research,"Healthcare/biotech, Software (SAAS)",Software (SAAS),Software (SAAS),Academia/ Research,"QA/Testing, Software","Software, Research",Software,Software,Software,"Software, Research",Very Good,Outstanding,Excellent,Excellent,Excellent,Excellent,20,12,20,23,24,11,No,,Yes,Karos Health,"Waterloo, Canada",University of Waterloo,"Waterloo, Canada",GlobeStar Systems,"Sao Miguel, Portugal",P&P Optica,"Waterloo, Canada",PerkinElmer,"Kitchener, Canada",Solvay,"Bordeaux, France",Exceeded my expectations,Exceeded my expectations,Exceeded my expectations,Awesome workplace! Favourite Co-op.,Exceeded my expectations,Awesome workplace! Favourite Co-op.,"Going to the gym, Playing board games/cards/puzzles, Reading, Playing an instrument(s), Watching movies/shows, Watching Youtube videos, Listening to music, Playing video games, Traveling, Watching sports, Playing sports",>4 hours,> 0 hours,>2 hours,Intramurals,BME,"Williams, Kabob Hut, Mr. Panino's, Subway, Lazeez, Shawarma Plus, iPotato, Pita Factory, Fresh Burrito",1,Program Events,8,8,8,6,8,5,8,7,5,9,10,8,8,8,7,8,8,9,7,7,INTP,Capricorn,Graduate Studies,"Graduate Studies, Full Time Employment",No,No,No,,,,,,,No,No,No,"MASc, Systems Design Engineering",Research,Masters,University of Waterloo,I don't know...,No,,,,,10,Depends on how much money I end up making,30,"Confident, Physically Attractive, Similar Beliefs, Respectful, Motivated",2,,
5/18/2020 9:10:49,Female,No,Caucasian,st catharines canada,niagara falls canada,In-province student,Language Immersion,"Student Council/Leadership roles, Sports, Social work/Volunteering, Part-time job",6-10 hours,95+,Yes,Bachelor's Degree,Yes,$150-200k,Socialism,Christian,Christian,"mte 320, ece 224, ece 340, bme 488, mte 220","econ 101, bet 100",2,3B,"tu delft, netherlands",None,None,,8,9,5,10,5,3,4,7,90-100,90-100,80-89,90-100,80-89,50-59,50-59,70-79,85,84,85,85,88,80,83,89,"Small class size, Exposure to different disciplines, Program reputation, Design courses",I call it an 'iceberg' degree: it sounds so specific (to the point where it might scare off non-bme employers) yet we have such a wide exposure to different disciplines (and in reality aren't well versed in any of them) ,Yes,I still don't know,Mechatronics Engineering,No,"Co-op, Reputation of Waterloo Engineering","Reputation of the program, Idea of combining STEM & Biology, The growing BME industry",No,Somewhat,No,,,,,"Yes, self-funded mostly","Yes, self-funded mostly","Yes, self-funded mostly","Yes, self-funded mostly",Software (SAAS),Hardware,Hardware,Hardware,Hardware,Hardware,Software,"Software, Hardware","Software, Hardware",Hardware,Hardware,Hardware,Excellent,Excellent,Excellent,Excellent,Excellent,Excellent,17,10,37,41,54,54,Yes,Yes,,Run Straight Consulting,Toronto canada,Nerv Tech,Waterloo Canada,Brachium Inc,Dublin California USA,Level Home ,Redwood City California USA,Apple Inc,Cupertino California USA,Apple Inc,Cupertino California USA,"It was alright, some regrets though",Exceeded my expectations,Exceeded my expectations,Awesome workplace! Favourite Co-op.,Exceeded my expectations,Exceeded my expectations,"Going to the gym, Playing board games/cards/puzzles, Reading, Watching movies/shows, Watching Youtube videos, Listening to music, Chilling with friends, Baking/cooking, Traveling, Hiking",>15 hours,>8 hours,>8 hours,,Other Programs,"Williams, Sweetdreams Tea Shop, iPotato",2,Through friends,10,8,8,9,8,9,10,8,9,10,9,10,10,8,10,8,7,10,8,8,Protagonist,Libra,Graduate Studies,"Full Time Employment, Startup",,No,Yes,,,,,,,Yes,No,No,Electrical Engineering,Course,Masters,U of T,Industry,Maybe,8 weeks,2 of us,No,Eastern Europe + UAE,3,No,~28,"Funny, Patient, Caring, Intelligent, Respectful",3,,
5/21/2020 17:50:17,Prefer Not to Specify,Prefer Not to Specify,Caucasian,"Ottawa, Canada","Hamilton, Canada",In-province student,"Advanced Placement (AP), Gifted, self-paced","Sports, Robotics/Tech, Social work/Volunteering, trivia ",6-10 hours,95+,Yes,Doctoral or Professional Degree,No,$50-100k,Liberalism,Spiritual but non-religious,Spiritual but non-religious,"SYDE 322, BME 487, CHE 361, KIN 415, NE 479, PSYCH 261","FINE 150, PSYCH 218, MUSIC 140",2,No,,None,None,,9,10,8,10,8,10,5,6,90-100,90-100,90-100,90-100,90-100,90-100,90-100,90-100,80.18,73.25,79.91,76.83,83.09,76.46,84.4,91.8,"Small class size, A department and faculty that cares, Sense of duty towards the well being of the public, Group work, Design courses",There was very little bio and very little time spent on the junction of biology/physiology and the things we were being taught to design and engineer. I expected to learn (or at least study) how to engineer things that would interact with the body. Instead I learned how to sort of engineer things and also studied basic biology that seemed like an elaboration on Grade 12.,No,I still don't know,No,kinesiology,Co-op,Potential for positive impact on people's lives,No,Yes,10-20k,,,,,,,,,"Healthcare/biotech, Academia/ Research","Healthcare/biotech, Software (SAAS)","Healthcare/biotech, Manufacturing","Healthcare/biotech, Academia/ Research","Academia/ Research, Government/ Non-profit","Academia/ Research, Government/ Non-profit",Research,"QA/Testing, Design/UX",Mechanical,"Software, Mechanical, Research",Research,Research,Very Good,Outstanding,Outstanding,Excellent,Excellent,Excellent,13.5,21,13.5,16.5,20,21,Yes,Yes,,University of Waterloo (lab),"Waterloo, Canada",NexJ Health,"Toronto, Canada",CellScale,"Waterloo, Canada",Sunnybrook Hospital,"Toronto, Canada",Defense Research and Development Canada,"Toronto, Canada",Defense Research and Development Canada,"Toronto, Canada","It was alright, some regrets though","Good company, met my expectations",Awesome workplace! Favourite Co-op.,"It was alright, some regrets though","Good company, met my expectations","Good company, met my expectations","Partying, Clubbing, Playing board games/cards/puzzles, Reading, Playing an instrument(s), Watching movies/shows, Watching Youtube videos, Listening to music, Yoga, Dancing, Chilling with friends, Singing, Baking/cooking, Traveling, Hiking, Volunteering",>4 hours,>4 hours,>4 hours,"EngSoc, Dance clubs","BME, CHEM",,1,high school,4,8,6,7,4,9,7,9,,,6,7,9,10,8,8,1,9,5,9,"fam it's different every time, mbti is B U N K",scorpio,"Full Time Employment, Another Undergraduate Program",Medical School,Medicine,No,No,,,,,,,Yes,Yes,No,,,,,,Yes,moving,"Just me, I'm a solo traveller.",No,British Columbia,5,No,,"Kind, Physically Attractive, Shared Interests, Adventurous, Motivated",2,,
5/22/2020 16:39:27,Male,No,South Asian,"Montreal, Canada","Mississauga, Canada",In-province student,International Baccalaureate (IB),"Sports, Social work/Volunteering",6-10 hours,95+,Yes,Master's Degree,Yes,$300k+,Socialism,Hindu,Hindu,"CHEM 266, CHEM 267, BIOL 273, SYDE 372","PSYCH 101, ECON 101, AFM 101, SYDE 533, SYDE 543",1,No,,None,None,,3,7,1,9,6,8,6,10,0-9,10-19,20-29,60-69,50-59,60-69,70-79,70-79,85,83,88,90,85,89,91,93,"The people, Sense of duty towards the well being of the public, Exposure to different disciplines",,No,Yes,Systems Design Engineering,No,"Co-op, Reputation of Waterloo Engineering","Pre-med, The growing BME industry, Potential for positive impact on people's lives",No,Yes,No,"Yes, self-funded mostly","Yes, self-funded mostly","Yes, self-funded mostly","Yes, self-funded mostly","Yes, self-funded mostly","Yes, self-funded mostly","Yes, self-funded mostly","Yes, self-funded mostly",Consulting,Consulting,Hardware,Healthcare/biotech,Healthcare/biotech,Healthcare/biotech,Business,Business,Mechanical,Software,Software,Software,Very Good,Very Good,Very Good,Very Good,Very Good,Very Good,20,20,20,27,29,31,Yes,Yes,,Deloitte,"Toronto, Canada",Deloitte,"Toronto, Canada",Thalmic Labs,"Waterloo, Canada",ON Semiconductor,"Waterloo, Canada",ON Semiconductor,"Waterloo, Canada",ON Semiconductor,"Waterloo, Canada","Good company, met my expectations","It was alright, some regrets though",Exceeded my expectations,Awesome workplace! Favourite Co-op.,Awesome workplace! Favourite Co-op.,Awesome workplace! Favourite Co-op.,"Climbing, Going to the gym, Playing board games/cards/puzzles, Watching movies/shows, Watching Youtube videos, Listening to music, Chilling with friends, Playing video games, Sleeping, Watching sports, Playing sports, Volunteering",>4 hours,>4 hours,>4 hours,Intramurals,"BME, TRON","Williams, Shinwa, Subway, Shawarma Plus",0,,5,8,4,6,6,7,4,8,1,6,8,9,10,10,5,7,5,10,6,8,,Cancer,Graduate Studies,Medical School,No,No,No,,,,,,,Yes,Yes,No,Medical Biophysics,Research,Masters,University of Toronto,More school,Yes,3 weeks,5,Yes,Iceland,6,Depends on how much money I end up making,,"Kind, Charismatic, Physically Attractive, Intelligent, Motivated",2,,
5/22/2020 20:54:45,Male,No,Caucasian,"Brantford, Canada","Brantford, Canada",In-province student,None,"Sports, Part-time job",6-10 hours,95+,No,Doctoral or Professional Degree,No,$250-300k,Liberalism,Christian,Christian,"Syde 522, Syde 544, Bme 450","Econ 101, Music 140, Dutch 1010",1,No,,None,,,7,9,4,5,6,6,4,4,90-100,90-100,90-100,90-100,80-89,80-89,50-59,50-59,89,85,92,84,87,87,87,88,"The people, Living almost exclusively in E5 6004, Socials (Biowasted, Coffee House, Potlucks)",How much programming there was,Yes,I still don't know,Systems Design Engineering,No,Co-op,It sounded interesting,Somewhat,No,No,,,,,,,,,Software (SAAS),Software (SAAS),Healthcare/biotech,Healthcare/biotech,Hardware,Hardware,Software,Software,Software,Research,Hardware,Hardware,Outstanding,Outstanding,Excellent,Excellent,Very Good,Excellent,16,12,21,18,25,25,Yes,Yes,,Brantford Police,"Brantford, Canada",HealthIM,"Waterloo, Canada",Intellijoint Surgical,"Waterloo, Canada",Nicoya,"Kitchener, Canada",Nymi,"Toronto, Canada",Nymi,"Toronto, Canada","Good company, met my expectations",Exceeded my expectations,Exceeded my expectations,Exceeded my expectations,"Good company, met my expectations","Good company, met my expectations","Partying, Clubbing, Playing board games/cards/puzzles, Playing an instrument(s), Watching Youtube videos, Chilling with friends, Watching sports, Playing sports",>8 hours,>4 hours,>4 hours,BioMechatronics,"BME, SYDE, TRON, MGMT, NANO, Math",Shawarma Plus,2,University,7,8,7,7,6,7,7,8,6,8,8,8,8,6,8,8,7,7,5,5,,,Graduate Studies,"Graduate Studies, Full Time Employment, Startup",No,No,No,,,,,,,No,No,No,SYDE,Course,Masters,Waterloo,Industry,Maybe,4 weeks,4,No,,8,No,27,"Funny, Charismatic, Physically Attractive, Social, Optimistic",3,,
