Timestamp,Check one or more options that reflect your gender.,Do you identify as Transgender (or another non-cisgender identity)? ,What's your ethnicity?,"Where were you born? Please list the city followed by the country (i.e. Scarborough, Canada)","Where did you live immediately before moving to UW? Please list the city followed by the country (i.e. Scarborough, Canada)",Which of the following are you? (based on tuition),Were you enrolled in any special high school programs/curriculum?,What kind of extracurricular activities were you involved with in high school?,How many hours a week did you spent on extracurricular activities in high school?,What was your high school entrance average that got you into BME/the University of Waterloo?,Did you take Biology in grade 12?,What is the highest level of education of either of your parents?,Do either of your parents have a STEM education?,What is your family's household income?,What political ideology do you most align with?,What most closely describes your religious school of thought?,What most closely describes the religious thought of your family?,"Which TEs did you take? (e.g. BME 388, ECE 252, ECE 459)? ","Which CSEs did you take (e.g. PSYCH 101, FINE 150)? ",How many URAs have you done?,"Did you go on exchange? If so, which term?","If you went on exchange, which school and city was it at (e.g. NTU, Singapore)?","If you are pursuing an Option, which one is it?","If you are pursuing a Specialization, which one is it?","Are you pursuing any other additional minors/majors/etc.? If so, what? (i.e. Minor in Fine Arts)","Stress by term (1 = Low Stress, 10 = High Stress) [1A]","Stress by term (1 = Low Stress, 10 = High Stress) [1B]","Stress by term (1 = Low Stress, 10 = High Stress) [2A]","Stress by term (1 = Low Stress, 10 = High Stress) [2B]","Stress by term (1 = Low Stress, 10 = High Stress) [3A]","Stress by term (1 = Low Stress, 10 = High Stress) [3B]","Stress by term (1 = Low Stress, 10 = High Stress) [4A]","Stress by term (1 = Low Stress, 10 = High Stress) [4B]",Class ATTENDANCE by term (percentage-wise) [1A],Class ATTENDANCE by term (percentage-wise) [1B],Class ATTENDANCE by term (percentage-wise) [2A],Class ATTENDANCE by term (percentage-wise) [2B],Class ATTENDANCE by term (percentage-wise) [3A],Class ATTENDANCE by term (percentage-wise) [3B],Class ATTENDANCE by term (percentage-wise) [4A],Class ATTENDANCE by term (percentage-wise) [4B],1A GPA,1B GPA,2A GPA,2B GPA,3A GPA,3B GPA,4A GPA,4B GPA,What do you like MOST about BME? Try not to check off more than 5 options.,What suprised you most about BME? Your responses might directly be quoted into the class profile.,Was BME your first choice for undergraduate program applications in grade 12?,"With what you know now, are you happy you chose BME?",Is there a UWaterloo Engineering program you feel is a better fit for you now that you have almost completed BME?,"With your current knowledge, would you have selected a different field of study/faculty?",What made you choose the University of Waterloo? Try to select as few options as possible.,What made you choose BME? Try not to check off more than 5 options.,Do you think the core BME/SYDE courses prepared you for your career or postgraduate studies?,Do you like Biology?,Are you graduating with debt? ,"Which terms were you mostly self-funded? (Ex. Tuition, rent, food, etc.) [1A]","Which terms were you mostly self-funded? (Ex. Tuition, rent, food, etc.) [1B]","Which terms were you mostly self-funded? (Ex. Tuition, rent, food, etc.) [2A]","Which terms were you mostly self-funded? (Ex. Tuition, rent, food, etc.) [2B]","Which terms were you mostly self-funded? (Ex. Tuition, rent, food, etc.) [3A]","Which terms were you mostly self-funded? (Ex. Tuition, rent, food, etc.) [3B]","Which terms were you mostly self-funded? (Ex. Tuition, rent, food, etc.) [4A]","Which terms were you mostly self-funded? (Ex. Tuition, rent, food, etc.) [4B]",What industry did you work in for each term? [1st Co-op],What industry did you work in for each term? [2nd Co-op],What industry did you work in for each term? [3rd Co-op],What industry did you work in for each term? [4th Co-op],What industry did you work in for each term? [5th Co-op],What industry did you work in for each term? [6th Co-op],What was your role each term? [1st Co-op],What was your role each term? [2nd Co-op],What was your role each term? [3rd Co-op],What was your role each term? [4th Co-op],What was your role each term? [5th Co-op],What was your role each term? [6th Co-op],What was your performance evaluation each term? [1st Co-op],What was your performance evaluation each term? [2nd Co-op],What was your performance evaluation each term? [3rd Co-op],What was your performance evaluation each term? [4th Co-op],What was your performance evaluation each term? [5th Co-op],What was your performance evaluation each term? [6th Co-op],"What was your HOURLY salary for your 1st Co-op in CAD (use 1USD = 1.3 CAD, 1EUR = 1.5 CAD) (Include housing stipends, bonuses, etc.)","What was your HOURLY salary for your 2nd Co-op in CAD (use 1USD = 1.3 CAD, 1EUR = 1.5 CAD)","What was your HOURLY salary for your 3rd Co-op in CAD (use 1USD = 1.3 CAD, 1EUR = 1.5 CAD)","What was your HOURLY salary for your 4th Co-op in CAD (use 1USD = 1.3 CAD, 1EUR = 1.5 CAD)","What was your HOURLY salary for your 5th Co-op in CAD (use 1USD = 1.3 CAD, 1EUR = 1.5 CAD)","What was your HOURLY salary for your 6th Co-op in CAD (use 1USD = 1.3 CAD, 1EUR = 1.5 CAD)",Did you do an 8 month Co-op?,"If you DID stay at the same company for 8 months, did you enjoy having an 8 month Co-op?","If you DIDN'T stay at the same company for 8 months, did you enjoy having two different back-to-back Co-ops?",1st Co-op: What was the name of the company? (leave blank if not applicable) ,"1st Co-op: Where was it located? Please list the city followed by the country (i.e. Waterloo, Canada)",2nd Co-op: What was the name of the company? (leave blank if not applicable) ,"2nd Co-op: Where was it located? Please list the city followed by the country (i.e. Waterloo, Canada)",3rd Co-op: What was the name of the company? (leave blank if not applicable) ,"3rd Co-op: Where was it located? Please list the city followed by the country (i.e. Waterloo, Canada)",4th Co-op: What was the name of the company? (leave blank if not applicable) ,"4th Co-op: Where was it located? Please list the city followed by the country (i.e. Waterloo, Canada)",5th Co-op: What was the name of the company? (leave blank if not applicable) ,"5th Co-op: Where was it located? Please list the city followed by the country (i.e. Waterloo, Canada)",6th Co-op: What was the name of the company? (leave blank if not applicable) ,"6th Co-op: Where was it located? Please list the city followed by the country (i.e. Waterloo, Canada)",How much did you enjoy working at each of the above companies? [Co-op 1],How much did you enjoy working at each of the above companies? [Co-op 2],How much did you enjoy working at each of the above companies? [Co-op 3],How much did you enjoy working at each of the above companies? [Co-op 4],How much did you enjoy working at each of the above companies? [Co-op 5],How much did you enjoy working at each of the above companies? [Co-op 6],What do you do for fun?,How physically active were and are you? (hours of activity per a week) [Grade 12],How physically active were and are you? (hours of activity per a week) [First Year],How physically active were and are you? (hours of activity per a week) [Last Year],What design teams and/or clubs did you participate in?,Which programs/faculties are your closest friends in? (Both within and outside of Waterloo),What restaurant(s) do you regularly go to in Waterloo? ,How many people have you dated between 2015-2020?,Where did you meet your partners?,Interpersonal Skills (Before University),Interpersonal Skills (After University),Physical Attractiveness (Before),Physical Attractiveness (After),Team Work & Cooperative Skills (Before),Team Work & Cooperative Skills (After),Work Ethic (Before),Work Ethic (After),Earning Potential (Before),Earning Potential (After),Intelligence (Before),Intelligence (After),Sense of Morals (Before),Sense of Morals (After),Confidence (Before),Confidence (After),Self Understanding (Before),Self Understanding (After),Emotional Intelligence (Before),Emotional Intelligence (After),"If you know your Myers Briggs personality type, please enter it here (ex. ENTP). You can find it here: https://www.16personalities.com/free-personality-test",What's your zodiac sign? Ex. Aquarius. You can find it here: https://whatismysign.net/,What are you planning on doing immediately after graduation?,Do you ever see yourself doing any of the following down the road?,"Are you considering a career change? If so, to which field?",Have you signed a full-time offer?,Are you returning or hoping to return to a company at which you did a Co-op?,"If you have finalized an offer, what is the name of the company?","If you have finalized an offer, where is the company located?","If you have finalized an offer, what is the type of the position?","If you have finalized an offer, what is your total compensation for your first year immediately after graduation (yearly salary + sign-on bonus + first year equity) in CAD?","If you have finalized an offer, how many years are you planning on staying at the company? ","If you have finalized an offer, is the company situated in the Health Industry (includes med tech, health tech, healthcare, etc.)?",Were you considering medical school when you started BME?,Did you or will you apply to medical school?,Are you going to medical school starting this September?,What program are you planning on taking?,Are you taking a course or research based program?,Are you pursuing a Masters or PhD?,What school are you going to attend? ,What do you plan on doing after grad school?,Are you going on a grad trip within a year after graduation?,How many weeks are you planning to be travelling for?,What is your grad trip group size?,Are you travelling with other BMEs?,"What countries are you going to? (And if travelling within US/Canada, please add the state/province)",How many classmates are you intending to stay in touch with?,Do you intend on donating to UW at some point in time?,"If you want to eventually get married, what age would you ideally want to get married at?",What are the top 5 qualities you look for in a partner?,"If you want children, how many do you eventually want to have?","If you are leaving Canada, how many years are you planning on leaving for?","If you are moving out of Canada, what are the most relevant reasons?"
3/8/2020 13:46:20,Male,No,East Asian,"Fuzhou, China","Barrie, Canada",In-province student,None,"Sports, Robotics/Tech, Social work/Volunteering",1-5 hours,95+,Yes,Bachelor's Degree,Yes,$100-150k,Liberalism,Atheist,Atheist,"SYDE 348, SYDE 543, BIOL 150, BME 489, SCI 250, SYDE 522","PSYCH 101, PSYCH 253, CLAS 104",1,No,N/A,None,None,N/A,6,6,5,7,5,6,3,3,90-100,90-100,90-100,90-100,80-89,80-89,80-89,70-79,78,76,81,80,84,83,90,80,"The people, Small class size, A department and faculty that cares, Sense of duty towards the well being of the public, Exposure to different disciplines",The similarity to SYDE,Yes,Yes,Mechatronics Engineering,No,"Co-op, Reputation of Waterloo Engineering","Idea of combining STEM & Biology, The growing BME industry, I like making things, Potential for positive impact on people's lives",Somewhat,Yes,No,,,,"Yes, self-funded mostly","Yes, self-funded mostly","Yes, self-funded mostly","Yes, self-funded mostly","Yes, self-funded mostly",Other,Academia/ Research,Healthcare/biotech,Healthcare/biotech,Healthcare/biotech,Healthcare/biotech,Other,"Hardware, Mechanical, Research","Hardware, Design/UX, Research","QA/Testing, Hardware, Design/UX, Research","Software, Hardware, Mechanical, Design/UX, Research","Software, Hardware, Mechanical, Design/UX, Research",Excellent,Outstanding,Excellent,Excellent,Excellent,Excellent,12,15,20,22,24,24,Yes,Yes,No,,,University of Waterloo,"Waterloo, Canada",Baylis Medical,"Mississauga, Canada",Baylis Medical,"Mississauga, Canada",Baylis Medical,"Mississauga, Canada",Baylis Medical,"Mississauga, Canada","It was alright, some regrets though","Good company, met my expectations",Exceeded my expectations,Exceeded my expectations,Awesome workplace! Favourite Co-op.,Awesome workplace! Favourite Co-op.,"Climbing, Going to the gym, Playing board games/cards/puzzles, Reading, Playing an instrument(s), Watching movies/shows, Watching Youtube videos, Listening to music, Chilling with friends, Playing video games, Singing, Sleeping, Baking/cooking, Hiking, Playing sports, Fishing",>6 hours,>4 hours,>4 hours,"BioMechatronics, Intramurals, Humans vs. Zombies","BME, Math, Business","Subway, Mel's Diner",1,Mutual friends outside of work,6,7,6,7,7,7,8,8,3,6,6,6,8,8,6,7,5,6,7,8,INFJ,Taurus,Full Time Employment,"Graduate Studies, Full Time Employment, Startup",No,Still Searching,Yes,,,,,,,No,No,No,,,,,,Maybe,2 weeks,4,Yes,"Alberta, BC, San Francisco? Originally planning to go to Asia, but...",6,Depends on how much money I end up making,26,"Kind, Funny, Caring, Adventurous, Intelligent",1,,
3/8/2020 14:02:26,Male,No,Caucasian,"Oshawa, Canada","Whitby, Canada",In-province student,Advanced Placement (AP),None,0,95+,Yes,Master's Degree,No,$150-200k,Liberalism,Atheist,Catholic,"SYDE 372, SYDE 533, SYDE 543, MSCI 432, MSCI 555, SYDE 542","PSYCH 101, ENGL 294, MSCI 211",0,No,,Management Sciences,None,,8,7,7,9,6,7,4,3,90-100,90-100,90-100,90-100,80-89,50-59,50-59,20-29,90,87,83,84,85,81,88,,"The people, Small class size, The professors, Living almost exclusively in E5 6004, Program reputation",,Yes,I still don't know,Software Engineering,No,"Co-op, Reputation of Waterloo Engineering","Idea of combining STEM & Biology, The growing BME industry, It sounded interesting, Potential for positive impact on people's lives",Somewhat,Yes,No,,,,"Yes, self-funded mostly","Yes, self-funded mostly","Yes, self-funded mostly","Yes, self-funded mostly","Yes, self-funded mostly",Software (SAAS),Software (SAAS),Software (SAAS),Software (SAAS),Software (SAAS),Software (SAAS),QA/Testing,PM,PM,Design/UX,Design/UX,Software,Excellent,Outstanding,Excellent,Outstanding,Outstanding,Outstanding,17,21,23,25,25,27,Yes,Yes,,Zynga,Toronto,Uken,Toronto,Veeva,Toronto,Nulogy,Toronto,Nulogy,Toronto,Nulogy,Toronto,"Good company, met my expectations",Awesome workplace! Favourite Co-op.,"It was alright, some regrets though",Awesome workplace! Favourite Co-op.,Awesome workplace! Favourite Co-op.,Awesome workplace! Favourite Co-op.,"Playing board games/cards/puzzles, Reading, Watching movies/shows, Watching Youtube videos, Listening to music, Chilling with friends, Playing video games, Sleeping",> 0 hours,>2 hours,> 0 hours,BME Acapella,BME,"East Side Marios, Subway, Shawarma Plus, Pita Factory",1,High School,7,9,5,9,7,9,4,7,4,8,9,9,8,8,7,7,6,8,7,8,INTJ,please no (Tauros),Full Time Employment,"Graduate Studies, Full Time Employment","Project Management, Product Design, Development",Still Searching,Yes,,,,,,,No,No,No,,,,,,Maybe,3 weeks,2 of us,No,"Scotland, Ireland, Netherlands, Germany",4,No,,"Shared Interests, Caring, Thoughtful, Optimistic, Reliable",,,
3/8/2020 14:05:01,Male,No,Caucasian,"Kitchener, Canada","Bracebridge, Canada",In-province student,None,None,0,95+,Yes,Bachelor's Degree,Yes,$300k+,Socialism,Atheist,Atheist,"SYDE 372, SYDE 533, SYDE 543, MSCI 432, MSCI 555, SCI 201","PSYCH 101, ENGL 294, MSCI 211",0,No,,Management Sciences,None,,9,9,9,9,9,9,3,3,80-89,80-89,70-79,70-79,60-69,60-69,30-39,30-39,80,80,80,80,80,80,80,80,"Small class size, Living almost exclusively in E5 6004, Program reputation",The classes kinda blew,Yes,No,Software Engineering,No,"Co-op, Reputation of Waterloo Engineering","Reputation of the program, Idea of combining STEM & Biology, The growing BME industry, It sounded interesting, I like making things",No,Somewhat,No,"Yes, self-funded mostly","Yes, self-funded mostly","Yes, self-funded mostly","Yes, self-funded mostly","Yes, self-funded mostly","Yes, self-funded mostly","Yes, self-funded mostly","Yes, self-funded mostly",Software (SAAS),Software (SAAS),"Healthcare/biotech, Software (SAAS)",Software (SAAS),Software (SAAS),Software (SAAS),Software,Software,Software,Software,Software,Software,Outstanding,Outstanding,Outstanding,Outstanding,Outstanding,Outstanding,16,18,22,40.28,87.28,87.28,Yes,Yes,,rBux,"Bracebridge, Canada",Sprout,"Toronto, Canada",OICR,"Toronto, Canada",Doximity,"San Francisco, United States",PlanGrid,"San Francisco, United States",Autodesk,"San Francisco, United States","Good company, met my expectations","Good company, met my expectations","Good company, met my expectations",Awesome workplace! Favourite Co-op.,Awesome workplace! Favourite Co-op.,Exceeded my expectations,"Playing board games/cards/puzzles, Playing an instrument(s), Watching movies/shows, Watching Youtube videos, Listening to music, Chilling with friends, Playing video games",>2 hours,>2 hours,>2 hours,BME Accapella,"BME, SE","East Side Marios, Subway, Lazeez, Shawarma Plus, Pita Factory",8,"School, Online, Dating apps",4,6,3,8,4,6,7,4,2,9,8,8,5,8,5,7,6,6,5,7,INTP,Leo (seriously?),Full Time Employment,"Full Time Employment, Startup",No,Yes,Yes,Doximity,"San Francisco, United States",Software,236782.62,4,Yes,No,No,No,,,,,,Yes,2 weeks,4,No,France,4,Depends on how much money I end up making,24,"Kind, Physically Attractive, Caring, Submissive, Good Career",2.5,8,"Money, More Interesting Job Opportunities, Climate"
3/8/2020 14:07:55,Male,No,Caucasian,"Kanata, Canada","Ancaster, Canada",In-province student,International Baccalaureate (IB),"Student Council/Leadership roles, Sports, Robotics/Tech, Social work/Volunteering, Part-time job",16-20 hours,90-94.9999,Yes,Doctoral or Professional Degree,Yes,$50-100k,Conservatism,Atheist,Spiritual but non-religious,"BIOL 382, MSCI 432, SYDE 543, MSCI 436, SYDE 522, SYDE 542","PSYCH 101, CLAS 104, RS110",0,No,,None,None,,6,7,5,9,7,6,2,2,80-89,80-89,60-69,70-79,50-59,50-59,30-39,20-29,79.36,75.25,78.09,74,79.64,75.36,79.8,,The people,The lack of Biology and the fact its just SYDE ,No,No,No,Science,Reputation of Waterloo Engineering,"Family pressure, Pre-med, Idea of combining STEM & Biology",No,Yes,No,"Yes, self-funded mostly","Yes, self-funded mostly","Yes, self-funded mostly","Yes, self-funded mostly","Yes, self-funded mostly","Yes, self-funded mostly","Yes, self-funded mostly","Yes, self-funded mostly","Hardware, Manufacturing",Other,Other,N/A,Other,Other,"Hardware, Mechanical",PM,PM,N/A,PM,PM,Excellent,Outstanding,Outstanding,N/A,Outstanding,Outstanding,18,26,27,,31,31,Yes,Yes,,RMF Design and Manufacturing,"Mississauga, Canada",Lenovo / Motorola Mobility,"North York, Canada",Lenovo / Motorola Mobility,"North York, Canada",,,Lenovo / Motorola Mobility,"North York, Canada",Lenovo / Motorola Mobility,"North York, Canada","Worst coop, its a trap!",Awesome workplace! Favourite Co-op.,Awesome workplace! Favourite Co-op.,N/A,Awesome workplace! Favourite Co-op.,Awesome workplace! Favourite Co-op.,"Going to the gym, Listening to music, Yoga, Playing video games, Hiking, Playing with my dog",>15 hours,>6 hours,>15 hours,Orientation Week,"BME, ECE, Medicine","Subway, Lazeez, Shawarma Plus",3,Mutual Friends,10,10,9,7,10,10,10,3,3,8,10,7,10,8,5,10,2,9,1,10,ENFJ-T,Pisces,Medical School,Medical School,Medicine,No,No,,,,,,,Yes,Yes,No,,,,,,Maybe,3 weeks,"Just me, I'm a solo traveller.",No,Road trip from Ontario through BC,3,No,31,"Confident, Shared Interests, Open-Minded, Caring, Thoughtful",2,,
3/8/2020 14:38:17,Male,No,Caucasian,"Calgary, Canada","Calgary, Canada",Out-of-province student,Advanced Placement (AP),Part-time job,6-10 hours,90-94.9999,Yes,Doctoral or Professional Degree,Yes,,Socialism,Agnostic,Catholic,"SYDE 372, SYDE 533, SYDE 543, SYDE 542, MSCI 432, MSCI 555","PSYCH 101, ENGL 294, MSCI 211",0,No,,Management Sciences,None,,8,6,6,7,7,6,6,6,90-100,90-100,90-100,90-100,90-100,70-79,80-89,30-39,86,76,80,72,78,74,86,,"The people, Small class size, Living almost exclusively in E5 6004, Program reputation",How general it is and how little actual biology we study,Yes,I still don't know,Software Engineering,,"Co-op, Reputation of Waterloo Engineering, High admission standards","Idea of being a guinea pig for a new program, High admission standards, Idea of combining STEM & Biology, It sounded interesting, Potential for positive impact on people's lives",Somewhat,Yes,No,,,,,,,,,Software (SAAS),Software (SAAS),Healthcare/biotech,"Healthcare/biotech, Software (SAAS)",Healthcare/biotech,Healthcare/biotech,Software,Software,Software,Software,Software,Software,Excellent,Outstanding,Outstanding,Excellent,Excellent,Outstanding,17.5,18.125,20.8,21,23.94,24.77,Yes,Yes,,ThoughtWire,"Toronto, Canada",rBux,"Bracebridge, Canada",Intellijoint Surgical,"Waterloo, Canada",Agfa Healthcare,"Waterloo, Canada",Intellijoint Surgical,"Waterloo, Canada",Intellijoint Surgical,"Waterloo, Canada","Good company, met my expectations","Good company, met my expectations",Exceeded my expectations,"Good company, met my expectations",Awesome workplace! Favourite Co-op.,Awesome workplace! Favourite Co-op.,"Playing board games/cards/puzzles, Reading, Watching movies/shows, Watching Youtube videos, Listening to music, Chilling with friends, Playing video games, Sleeping",> 0 hours,> 0 hours,0,Intramurals,"BME, SE","Williams, Chen's, East Side Marios, Subway, Shawarma Plus, Pita Factory, The above are only semi-regularly, and all but Williams are USUALLY by delivery",0,,6,7,6,5,7,8,4,3,2,8,5,7,6,7,4,5,4,7,4,7,INFP,Sagittarius,Full Time Employment,"Graduate Studies, Full Time Employment, Another Undergraduate Program",No,Still Searching,No,,,,,,,No,No,No,,,,,,Maybe,2 weeks,"Just me, I'm a solo traveller.",No,,3,No,26-28-ish,"Kind, Physically Attractive, Open-Minded, Thoughtful, Respectful",1,,
3/8/2020 15:07:55,Female,No,East Asian,"Guangzhou, China","Mississauga, Canada",In-province student,International Baccalaureate (IB),"Social work/Volunteering, Part-time job",6-10 hours,95+,Yes,Master's Degree,Yes,$50-100k,Socialism,Atheist,Agnostic,"SYDE 322, SYDE 533, BME 450, SYDE 522, MSCI 555, SCI 238","CLAS 104, CLAS 202, FINE 130",1,No,,None,None,,8,10,7,9,7,8,5,3,90-100,90-100,90-100,90-100,90-100,90-100,80-89,70-79,93,91,87,92,91,84,87,80,"Small class size, A department and faculty that cares, Class gender ratio, Socials (Biowasted, Coffee House, Potlucks)","That there isn't really such a thing as a ""BME"" job",Yes,No,Software Engineering,Math,"Co-op, Reputation of Waterloo Engineering","Reputation of the program, High admission standards, Idea of combining STEM & Biology, The growing BME industry, It sounded interesting",Somewhat,Yes,No,"Yes, self-funded mostly","Yes, self-funded mostly","Yes, self-funded mostly","Yes, self-funded mostly","Yes, self-funded mostly","Yes, self-funded mostly","Yes, self-funded mostly","Yes, self-funded mostly",Software (SAAS),"Healthcare/biotech, Software (SAAS)","Healthcare/biotech, Software (SAAS)",Software (SAAS),Software (SAAS),"Software (SAAS), Finance/ Insurance","QA/Testing, IT, Software","QA/Testing, Software",Software,Software,Software,Software,Outstanding,Outstanding,Outstanding,Outstanding,Outstanding,Outstanding,17,21,25,53,81,81,No,,Yes,ACS Athletics,"Stouffville, Canada",Focal Healthcare,"Toronto, Canada",Veeva Systems,"Toronto, Canada",Google,"Waterloo, Canada",Facebook,"Seattle, US",Stripe,"San Francisco, US","It was alright, some regrets though","Good company, met my expectations","Good company, met my expectations",Exceeded my expectations,Awesome workplace! Favourite Co-op.,"Good company, met my expectations","Going to the gym, Playing board games/cards/puzzles, Reading, Watching movies/shows, Watching Youtube videos, Listening to music, Yoga, Chilling with friends, Playing video games, Baking/cooking, Watching sports, Food exploration",> 0 hours,>2 hours,>2 hours,"BioMechatronics, BluePrint","BME, SYDE, SE, Science, Arts","Sweetdreams Tea Shop, Ken Sushi",1,High school,7,8,7,8,6,6,9,8,5,10,9,9,6,6,7,8,7,9,7,8,INTJ,Taurus,Full Time Employment,Full Time Employment,No,Yes,Yes,Facebook,"Seattle, US",Software,365300,5,No,No,No,No,,,,,,Maybe,3 weeks,2 of us,No,Probably all over Canada ,3,No,25,"Kind, Funny, Physically Attractive, Similar Beliefs, Patient",,10,"Money, More Interesting Job Opportunities"
