3/16/2020 7:49:32,Female,No,Caucasian,"Kitchener, Canada","Waterloo, Canada",In-province student,Advanced Placement (AP),"Sports, Band/Orchestra, Part-time job",21-25 hours,90-94.9999,Yes,Bachelor's Degree,Yes,$150-200k,Liberalism,Agnostic,Atheist,"SYDE 372, BME 450, MTE 545, BME 489, NE 469, NE 479","PSYCH 101, MUSIC 246, MUSIC 140",1,No,,None,None,,7,6,5,7,7,7,6,7,90-100,90-100,90-100,90-100,90-100,90-100,90-100,90-100,84.54,83.67,87.27,88.5,91.73,86.82,89,,"The people, Small class size, The professors, Exposure to different disciplines",,Yes,Yes,Mechatronics Engineering,No,"Co-op, Reputation of Waterloo Engineering, High admission standards","Family pressure, High admission standards, Idea of combining STEM & Biology, It sounded interesting, I like making things",Somewhat,Yes,No,,,,,"Yes, self-funded mostly","Yes, self-funded mostly","Yes, self-funded mostly","Yes, self-funded mostly",Healthcare/biotech,"Hardware, Manufacturing","Healthcare/biotech, Academia/ Research",Hardware,"Hardware, Manufacturing",Hardware,Mechanical,"Software, Hardware, Mechanical",Research,"Hardware, Mechanical","QA/Testing, Hardware, Mechanical","Hardware, Mechanical",Outstanding,Outstanding,Excellent,Outstanding,Outstanding,Excellent,17,19,13,24.4,24,28.75,No,,Yes,Synaptive Medical,"Toronto, Canada",Teledyne DALSA,"Waterloo, Canada",University of Waterloo,"Waterloo, Canada",Adhawk Microsystems,"Kitchener, Canada",Teledyne DALSA,"Waterloo, Canada",Adhawk Microsystems,"Kitchener, Canada",Exceeded my expectations,Exceeded my expectations,"It was alright, some regrets though",Exceeded my expectations,"Good company, met my expectations","Good company, met my expectations","Going to the gym, Playing board games/cards/puzzles, Reading, Watching movies/shows, Watching Youtube videos, Listening to music, Watching sports",>10 hours,>2 hours,> 0 hours,"BioMechatronics, Intramurals","BME, Math, Science, Arts, Not pursuing a University Degree",,1,Elementary school,6,7,6,7,6,7,8,8,5,7,7,8,7,9,6,7,6,8,6,8,,Aquarius,Full Time Employment,Medical School,No,Yes,No,MedAvail,"Mississauga, Canada",Hardware,65000,,Yes,No,No,No,,,,,,Yes,1 week,4,No,"Florida, US",5,Depends on how much money I end up making,25,"Funny, Shared Interests, Open-Minded, Caring, Reliable",,,
3/16/2020 18:03:13,Female,No,East Asian,"Seoul, Korea","Oakville, Canada",In-province student,None,"Student Council/Leadership roles, Band/Orchestra, Social work/Volunteering",1-5 hours,95+,Yes,Bachelor's Degree,No,$150-200k,Liberalism,Catholic,Catholic,"SYDE 372, KIN 416, SYDE 543, SYDE 542, SYDE 522, BIOL 373","PSYCH 101, CLAS 104, Psych 238",2,No,,None,None,,5,6,6,6,7,6,4,3,10-19,20-29,50-59,60-69,70-79,70-79,70-79,70-79,79,74,80,80,83,83,89,89,"The people, A department and faculty that cares, Program reputation, Class gender ratio, Socials (Biowasted, Coffee House, Potlucks)",,No,I still don't know,No,Science,"Co-op, Reputation of Waterloo Engineering","Family pressure, Pre-med, Reputation of the program, Idea of combining STEM & Biology, The growing BME industry",Somewhat,Yes,20-30k,,,,,,"Yes, self-funded mostly","Yes, self-funded mostly","Yes, self-funded mostly",Healthcare/biotech,Software (SAAS),Manufacturing,N/A,Software (SAAS),Software (SAAS),"IT, Software",QA/Testing,Mechanical,N/A,"Software, Research","IT, Software",Excellent,Outstanding,Excellent,N/A,Excellent,Excellent,,,,,,,Yes,No,,Conrad,"Waterloo, Canada ",OpenText Corp,"Richmond Hill, Canada ",,,,,CADmech Design ,"Toronto, Canada ",IFDS,"Toronto, Canada","It was alright, some regrets though","Good company, met my expectations","It was alright, some regrets though",N/A,Awesome workplace! Favourite Co-op.,Exceeded my expectations,"Partying, Playing board games/cards/puzzles, Watching movies/shows, Watching Youtube videos, Listening to music, Chilling with friends, Singing, Sleeping",>8 hours,>6 hours,>2 hours,"BioMechatronics, Engineers in Medicine, Orientation Week","ECE, Math, Science","Kabob Hut, Shinwa, Subway, Nuri Village, Mel's Diner, Ken Sushi",1,residence,8,6,6,9,4,7,7,9,4,9,6,9,7,9,8,7,9,9,7,10,,,"Graduate Studies, Full Time Employment, Medical School","Full Time Employment, Medical School",Medicine,No,No,,,,,,,Yes,Yes,No,,,,,,Maybe,,,,,4,No,29,"Funny, Confident, Physically Attractive, Shared Interests, Good Career",4,,Family / Relationship
3/17/2020 11:10:40,Female,No,East Asian,"Shanghai, China","Richmond Hill, Canada",In-province student,"Advanced Placement (AP), English as a second language",Social work/Volunteering,1-5 hours,95+,Yes,Bachelor's Degree,Yes,$50-100k,Conservatism,Neither spiritual nor religious,Neither spiritual nor religious,"ECE 484, SYDE 575, BME 451, ME 547, MTE 546, MTE 544, SYDE 544","PSYCH 101, EASIA 201R, PSYCH 257",1,No,,None,None,,1,3,3,6,4,5,8,10,90-100,90-100,90-100,90-100,90-100,90-100,90-100,90-100,91,86,87,93,90,86,89,,"Small class size, A department and faculty that cares, Exposure to different disciplines, Living almost exclusively in E5 6004, Class gender ratio",,No,I still don't know,Mechatronics Engineering,No,"Co-op, Location","Small class size, High admission standards, The growing BME industry",Somewhat,Yes,20-30k,,"Yes, self-funded mostly","Yes, self-funded mostly","Yes, self-funded mostly","Yes, self-funded mostly","Yes, self-funded mostly","Yes, self-funded mostly","Yes, self-funded mostly",Hardware,Academia/ Research,Hardware,Academia/ Research,Hardware,Hardware,Mechanical,Research,Hardware,Research,Hardware,Hardware,Excellent,Very Good,Excellent,Excellent,Excellent,Excellent,16.5,18,,20,25,25,Yes,Yes,,SM Research Inc,"Markham, Canada",Baylis Medical,"Mississauga, Canada",Myant Inc,"Etobioke, Canada",Sunnybrook Research Institute,"Toronto, Canada",Sickkids Hospital,"Toronto, Canada",Sickkids Hospital,"Toronto, Canada","Good company, met my expectations","It was alright, some regrets though","Worst coop, its a trap!",Exceeded my expectations,Exceeded my expectations,Exceeded my expectations,"Reading, Playing an instrument(s), Watching movies/shows, Watching Youtube videos, Listening to music, Chilling with friends, Singing, Baking/cooking, Traveling, Hiking, Food exploration",> 0 hours,> 0 hours,> 0 hours,,"TRON, ECE, NANO","Harvey's, Sweetdreams Tea Shop, Ken Sushi",5,,4,7,5,6,5,8,,,,,7,7,,,6,7,7,7,,,,,Graduate Studies,Graduate Studies,No,No,No,,,,,,,Yes,No,No,Biomedical Engineering,Research,Masters,,I don't know...,No,,,,,,Depends on how much money I end up making,,"Confident, Similar Beliefs, Patient, Caring, Intelligent",1,,"Travel, Personal Growth, More Interesting Job Opportunities"
3/17/2020 13:18:15,Male,No,East Asian,"Seoul, Korea","Oakville, Canada",In-province student,None,"Sports, Band/Orchestra, Social work/Volunteering, Religious, Part-time job",11-15 hours,95+,Yes,Master's Degree,Yes,$100-150k,Liberalism,Agnostic,Catholic,"SYDE 322, SYDE 575, ECE 356, SYDE 522, SCI 238, SYDE 334","PSYCH 101, PSYCH 207, RS 121",1,No,,None,None,,6,7,3,7,6,6,8,3,90-100,90-100,90-100,90-100,90-100,80-89,80-89,50-59,89,81,83,84,85,82,85,,"The people, Small class size, Living almost exclusively in E5 6004, Group work, Socials (Biowasted, Coffee House, Potlucks)",How little the program had to do with biology,Yes,I still don't know,Software Engineering,No,"Co-op, Reputation of Waterloo Engineering","The growing BME industry, It sounded interesting, I like making things, Potential for positive impact on people's lives",Somewhat,No,10-20k,,"Yes, self-funded mostly","Yes, self-funded mostly","Yes, self-funded mostly","Yes, self-funded mostly","Yes, self-funded mostly","Yes, self-funded mostly","Yes, self-funded mostly",Software (SAAS),"Healthcare/biotech, Academia/ Research",Software (SAAS),N/A,"Healthcare/biotech, Software (SAAS)",Software (SAAS),Software,Research,Software,N/A,Software,Software,Excellent,Very Good,Outstanding,N/A,Excellent,Outstanding,12,16,21,,31.25,28,No,No,Yes,Red Meat Games,"Kitchener, Canada",Sunnybrook,"Toronto, Canada",Flipp,"Etobicoke, Canada",,,Veeva Systems,"Toronto, Canada",Ritual,"Toronto, Canada","Good company, met my expectations","It was alright, some regrets though",Exceeded my expectations,N/A,"It was alright, some regrets though",Exceeded my expectations,"Going to the gym, Playing board games/cards/puzzles, Playing an instrument(s), Watching movies/shows, Watching Youtube videos, Listening to music, Chilling with friends, Playing video games, Sleeping, Watching sports",>4 hours,> 0 hours,> 0 hours,"BioMechatronics, Intramurals, Orientation Week, Orchestra/Choir/Acapella, Humans vs. Zombies","BME, SE, Math, Science","Williams, Kabob Hut, Shawarma Plus, iPotato, Mel's Diner",5,"School, dating apps",3,6,6,8,5,5,8,3,7,8,9,3,7,7,3,7,4,6,2,5,ISFP,Leo,Full Time Employment,Full Time Employment,No,Yes,Yes,Ritual,"Toronto, Canada",Software,85000,2,No,No,No,No,,,,,,Yes,4 weeks,3,Yes,"Japan, Korea",6,No,30,"Kind, Physically Attractive, Shared Interests, Thoughtful, Optimistic",2,,
3/17/2020 18:35:46,Female,No,Caucasian,"Waterloo, Canada","Waterloo, Canada",In-province student,International Baccalaureate (IB),"Student Council/Leadership roles, Sports, Social work/Volunteering, Religious",16-20 hours,95+,Yes,College Degree,No,$50-100k,Liberalism,Christian,Christian,"BIOL 382, BME 487, BME 488, BME 489, NE 479, SYDE 575","BME 364, BME 381, CLAS 101, CLAS 202, PSYCH 101",2,No,,None,None,No,5,4,4,8,7,8,10,9,90-100,90-100,90-100,90-100,90-100,90-100,90-100,90-100,86,80,82,85,88,83,84,,"The people, Small class size, A department and faculty that cares, Sense of duty towards the well being of the public, Program reputation","I was definitely most surprised at how much emphasis was being placed on engineering design, linear signals/systems, and coding/software projects rather than diving a deeper in the biological and medical side of things. We only got one course in cell biology, chemistry, and anatomy/physiology with only very high-level medical applications given in other courses. This did make me think for a while that I should have gone into Nanotechnology Engineering. In hindsight, however, I can see the need for that design of the program so that we can graduate with the fundamentals to actually systematically work between the body and engineering technologies. I think I've long since realized that getting deeper into the actual ""biomedical"" part of Biomedical Engineering means going for graduate studies.",Yes,Yes,No,No,"Co-op, Location, Reputation of Waterloo Engineering","The curriculumn, Reputation of the program, Idea of combining STEM & Biology, The growing BME industry, Potential for positive impact on people's lives",Yes,Yes,<10k,,,"Yes, self-funded mostly","Yes, self-funded mostly","Yes, self-funded mostly","Yes, self-funded mostly","Yes, self-funded mostly","Yes, self-funded mostly",Finance/ Insurance,Government/ Non-profit,"Software (SAAS), Government/ Non-profit","Healthcare/biotech, Manufacturing","Healthcare/biotech, Manufacturing","Healthcare/biotech, Manufacturing","IT, Design/UX","IT, Software","Software, Design/UX",Research,Research,Research,Outstanding,Outstanding,Outstanding,Excellent,Outstanding,Outstanding,18.8,18.8,21.7,16.5,19.9,19.9,Yes,Yes,,LOGiQ3,"Toronto, Canada",Multiple Sclerosis Society of Canada,"Toronto, Canada",Ontario Institute for Cancer Research,"Toronto, Canada",Nicoya,"Kitchener, Canada",Nicoya,"Kitchener, Canada",Nicoya,"Kitchener, Canada",Exceeded my expectations,"Good company, met my expectations","Good company, met my expectations",Awesome workplace! Favourite Co-op.,Awesome workplace! Favourite Co-op.,Awesome workplace! Favourite Co-op.,"Playing board games/cards/puzzles, Reading, Playing an instrument(s), Watching movies/shows, Watching Youtube videos, Listening to music, Chilling with friends, Singing, Baking/cooking, Hiking, Knitting, Drawing, Biking, Skating",>8 hours,>4 hours,>2 hours,"Engineers in Medicine, EngSoc, Cadaveric Dissection Club (AHS)","BME, NANO, Other Programs, Not pursuing a University Degree","Williams, Sweetdreams Tea Shop, Shawarma Plus, iPotato",0,N/A,10,10,10,10,10,10,9,9,6,9,10,10,10,10,7,9,10,10,10,10,INFJ-A,Capricorn,Graduate Studies,"Full Time Employment, Startup",No,No,No,,,,,,,Yes,No,No,Electrical and Computer Engineering - Biomedical Engineering Specialization,Research,Masters,University of Waterloo,"More school, Industry",Yes,2 weeks,2 of us,No,"Netherlands, France, United Kingdom",10,Depends on how much money I end up making,25,"Physically Attractive, Similar Beliefs, Caring, Intelligent, Reliable",2,,
3/27/2020 8:07:30,Male,No,South Asian,"Rupandehi, Nepal","Kitchener, Ontario",In-province student,None,"Student Council/Leadership roles, Sports, Band/Orchestra, Social work/Volunteering, Part-time job",6-10 hours,90-94.9999,Yes,Vocational Training,No,$50-100k,Liberalism,Agnostic,Hindu,"SYDE 372, ECE 484, SYDE 575, ECE 493, SYDE 522, SYDE 544, PHYS 225","PSCI 100, MUSIC 140, MUSIC 275",2,No,,None,None,,4,7,6,5,8,10,8,7,90-100,90-100,80-89,90-100,80-89,80-89,70-79,70-79,87,82,81,86,83,78,79,80,"The people, Small class size, A department and faculty that cares, Class gender ratio, Socials (Biowasted, Coffee House, Potlucks)","How much Biology / Science there is - Very little. Big focus on Engineering, which makes sense since it is an engineering program.",Yes,Yes,Mechatronics Engineering,No,Co-op,"Small class size, Idea of being a guinea pig for a new program, Idea of combining STEM & Biology, The growing BME industry, Potential for positive impact on people's lives",Yes,Somewhat,10-20k,"Yes, self-funded mostly","Yes, self-funded mostly","Yes, self-funded mostly","Yes, self-funded mostly","Yes, self-funded mostly","Yes, self-funded mostly","Yes, self-funded mostly","Yes, self-funded mostly",Hardware,Software (SAAS),Healthcare/biotech,Healthcare/biotech,Healthcare/biotech,Healthcare/biotech,"Software, Hardware, Research",Software,"Software, Hardware, Mechanical","QA/Testing, Software, Hardware, Mechanical, Design/UX, Research","QA/Testing, Software, Hardware, Design/UX, Research, Other","QA/Testing, Software, Hardware, Design/UX, Research, Other",Very Good,Excellent,Excellent,Excellent,Excellent,Outstanding,19.84,20.61,20.8,13,20,20,Yes,Yes,,ON Semiconductor,"Waterloo, Canada",Bayer,"Mississauga, Canada",Intellijoint Surgical,"Waterloo, Canada",NERv,"Kitchener, Ontario",Myant,"Toronto, Canada",Myant,"Toronto, Canada","It was alright, some regrets though","It was alright, some regrets though",Awesome workplace! Favourite Co-op.,"Good company, met my expectations","Good company, met my expectations","Good company, met my expectations","Climbing, Going to the gym, Partying, Playing board games/cards/puzzles, Reading, Playing an instrument(s), Watching movies/shows, Watching Youtube videos, Listening to music, Chilling with friends, Playing video games, Traveling, Hiking, Watching sports, Playing sports",>4 hours,>4 hours,>4 hours,"BioMechatronics, Engineers Without Borders, Orientation Week","BME, SYDE, TRON, MGMT, Science, Environemt","Williams, Harvey's, Shinwa, Shawarma Plus",4,"School, Extra-cirriculars",9,7,5,8,9,8,8,5,6,8,6,8,5,9,6,8,8,5,3,8,ENFP-T,Libra,Full Time Employment,"Graduate Studies, Medical School",No,Yes,No,TDK,San Jose,Research and Development,"98,000",2,Yes,Yes,No,No,,,,,,Yes,6 weeks,5,Yes,"Iceland, UK, Nepal, Austrailia",20,No,30,"Kind, Funny, Shared Interests, Open-Minded, Intelligent",3,2,"Travel, Money, Personal Growth, New Experiences, More Interesting Job Opportunities"
3/28/2020 10:42:28,Female,No,Caucasian,"Winnipeg, Canada","Lockport, Manitoba, Canada",Out-of-province student,None,"Sports, Band/Orchestra",16-20 hours,95+,Yes,Master's Degree,Yes,$150-200k,,Agnostic,Christian,"BME 451, BME 450, BME 488, BME/NE 498, GENE 499","APPLS 301, FINE 100, LS 101",2,No,,None,None,,8,9,9,7,6,7,4,3,80-89,80-89,60-69,80-89,70-79,80-89,80-89,90-100,79,73,79,80,82,81,86,,"The people, Small class size, A department and faculty that cares, The professors, Exposure to different disciplines, Living almost exclusively in E5 6004, Design courses, Class gender ratio",How little biology was in the curriculum ,Yes,Yes,No,No,"Co-op, Reputation of Waterloo Engineering","Reputation of the program, High admission standards, Idea of combining STEM & Biology, The growing BME industry, It sounded interesting",Somewhat,Yes,No,,,,,,,,,Consulting,Other,Academia/ Research,Academia/ Research,Healthcare/biotech,Academia/ Research,Mechanical,Design/UX,Research,Research,Research,Research,Very Good,Outstanding,Excellent,Excellent,Outstanding,Excellent,,,,,,,No,,Yes,KGS Engineering Consultants,"Winnipeg, Canada",University of Waterloo,"Waterloo, Canada",University of Waterloo,"Waterloo, Canada",Sorbonne University,"Paris, France",Grand River Hospital,"Kitchener, Canada",Sorbonne University,"Paris, France","It was alright, some regrets though","It was alright, some regrets though",Exceeded my expectations,Exceeded my expectations,Exceeded my expectations,"Good company, met my expectations","Playing board games/cards/puzzles, Watching movies/shows, Watching Youtube videos, Chilling with friends, Sleeping, Traveling, Hiking, Watching sports, Playing sports",>15 hours,>15 hours,>6 hours,"Intramurals, Varsity Sports","BME, SYDE, NANO, Applied Health Science","Williams, Chen's, Kabob Hut, Harvey's, Subway, Nuri Village, Lazeez, Molly Bloom's, Baba Grill, Pita Factory, Fresh Burrito, Mel's Diner",1,"On co-op, we worked together",4,8,8,7,5,8,9,8,2,9,4,8,10,7,10,7,3,9,3,9,,Gemini,Full Time Employment,"Graduate Studies, Full Time Employment, Startup","Business, Product Design",Still Searching,No,,,,,,,No,No,No,,,,,,No,,,,,5,No,28,"Funny, Caring, Respectful, Social, Optimistic",2,,
3/28/2020 15:49:02,Female,No,Caucasian,"Welland, Canada","Welland, Canada",In-province student,None,"Student Council/Leadership roles, Sports, Robotics/Tech, Social work/Volunteering, Part-time job",25+ hours,95+,Yes,Bachelor's Degree,No,$150-200k,Liberalism,Atheist,Catholic,"STAT332, SYDE372, SYDE543, ECE356, ECE358, SCI201","INST101, MUSIC140, HIST207",0,No,,None,None,,8,8,6,9,7,7,6,6,90-100,90-100,90-100,90-100,90-100,90-100,90-100,80-89,72,72,79,79,79,79,84,84,"The people, A department and faculty that cares, Sense of duty towards the well being of the public, The professors, Exposure to different disciplines, Group work, Class gender ratio, Socials (Biowasted, Coffee House, Potlucks)","""I think the thing that surprised me the most is how cool everyone is, how everyone is willing to help each other out, spread knowledge the opportunity to branch into different kinds of engineering.""",Yes,Yes,Systems Design Engineering,No,Co-op,"High admission standards, Idea of combining STEM & Biology",Yes,Yes,No,,,"Yes, self-funded mostly","Yes, self-funded mostly","Yes, self-funded mostly","Yes, self-funded mostly","Yes, self-funded mostly","Yes, self-funded mostly",Healthcare/biotech,Healthcare/biotech,"Healthcare/biotech, Software (SAAS)",Healthcare/biotech,Software (SAAS),"Healthcare/biotech, Software (SAAS)",Software,Software,Software,Software,Software,Software,Outstanding,Outstanding,Excellent,Excellent,Excellent,Excellent,16.5,16.5,20,20,25,52,No,,Yes,Niagara Health,"St. Catharines, Canada",Niagara Health,St. Catharines,DoctorCare,"Toronto, Canada",University Health Network ,"Toronto, Canada",Validere,"Toronto, Canada",Grand Rounds,"San Francisco, United States",Exceeded my expectations,"It was alright, some regrets though",Exceeded my expectations,"Good company, met my expectations",Exceeded my expectations,Awesome workplace! Favourite Co-op.,"Going to the gym, Partying, Clubbing, Watching movies/shows, Listening to music, Yoga, Chilling with friends, Sleeping, Traveling, Playing sports",>15 hours,>10 hours,>10 hours,"Intramurals, Varsity Sports","BME, SYDE, NANO, Applied Health Science, Arts, Not pursuing a University Degree",Williams,3,"Highschool, tinder, co-op",8,8,6,7,7,10,8,8,3,8,6,8,7,9,4,6,5,10,3,9,ENFP,Pisces,Full Time Employment,Graduate Studies,No,Yes,No,Grand Rounds,San Francisco,Software,"165,650.00",4,Yes,Yes,No,No,,,,,,Yes,8 weeks,3,Yes,SE Asia,8,Depends on how much money I end up making,28,"Open-Minded, Adventurous, Intelligent, Respectful, Motivated",2,5,"Travel, Money, Personal Growth"
4/18/2020 10:10:42,Female,No,Caucasian,"Barrie, Ontario","Barrie, Ontario",In-province student,None,"Sports, Social work/Volunteering, Part-time job",21-25 hours,95+,Yes,Master's Degree,Yes,$300k+,Liberalism,Agnostic,Catholic,"SCI 201, SYDE 522, SYDE 544, BME 487, SYDE 575","HIST 111, ECON 102, RS 100, FR 192A, CLAS 202, SPAN 101",5,No,,International Studies in Engineering,None,,7,9,3,9,7,8,3,1,90-100,90-100,60-69,80-89,60-69,50-59,20-29,10-19,87.18,82.67,83.73,84.08,87,87,85,,"The people, Small class size, A department and faculty that cares, Group work, Socials (Biowasted, Coffee House, Potlucks)",,Yes,Yes,Systems Design Engineering,No,Co-op,"Idea of combining STEM & Biology, It sounded interesting",Somewhat,Somewhat,No,,,,,,,,,"Healthcare/biotech, Academia/ Research","Healthcare/biotech, Software (SAAS)",Healthcare/biotech,"Healthcare/biotech, Academia/ Research",Other,Other,"Mechanical, Research","QA/Testing, Software","QA/Testing, Other","Software, Research","Software, Other","Software, Other",Excellent,Excellent,Excellent,Outstanding,Outstanding,Outstanding,12.5,17.25,20,22,7.8,7.8,Yes,Yes,,University of Waterloo,"Waterloo, Canada",Agfa Healthcare,"Waterloo, Canada",Synaptive,"Toronto, Canada",St. Joseph's Hospital,"Hamilton, Canada",Jaza Energy,"Dar Es Salaam, Tanzania",Jaza Energy ,"Dar Es Salaam, Tanzania",Exceeded my expectations,"Good company, met my expectations","Good company, met my expectations",Exceeded my expectations,Awesome workplace! Favourite Co-op.,Awesome workplace! Favourite Co-op.,"Climbing, Playing board games/cards/puzzles, Reading, Chilling with friends, Baking/cooking, Traveling, Hiking, Playing sports",>15 hours,>4 hours,>15 hours,"BioMechatronics, Intramurals, Orientation Week, EngSoc","BME, Applied Health Science, Arts","Williams, Chen's, Kabob Hut, Sweetdreams Tea Shop, Baba Grill, Mel's Diner",3,"High School, Clubs, Online",8,8,8,8,8,8,10,5,5,8,8,6,8,8,8,9,8,9,8,8,ENFP,Aquarius,Unemployed,"Graduate Studies, Full Time Employment, Startup",No,Still Searching,No,,,,,,,No,No,No,,,,,,No,,,,,,No,,"Open-Minded, Caring, Adventurous, Intelligent, Motivated",0,,"Travel, Personal Growth, New Experiences"
5/9/2020 11:33:14,Male,No,Caucasian,"Wichita, USA","Waterloo, Canada",In-province student,None,"Sports, Band/Orchestra, Social work/Volunteering, Religious",1-5 hours,95+,Yes,Doctoral or Professional Degree,No,$250-300k,Conservatism,Christian,Christian,"BME 488, CIVE 460, SYDE 543, BIOL 280","FINE 252, FINE 112, FINE 101, FINE 150, FINE 130",1,No,,None,None,Minor in Fine Arts,7,9,7,8,7,7,7,7,60-69,50-59,60-69,70-79,80-89,80-89,80-89,90-100,78,68,73,78,82,82,90,90,"The people, Small class size, A department and faculty that cares, Class gender ratio, Socials (Biowasted, Coffee House, Potlucks)","The gender ratio, and how different we were from other programs, specifically how close-knit and friendly we all were and how we all knew eachother ",Yes,Yes,No,No,"Co-op, Reputation of Waterloo Engineering","Reputation of the program, Idea of combining STEM & Biology, The growing BME industry, It sounded interesting, Potential for positive impact on people's lives",Yes,Somewhat,No,,,,,,,,,Consulting,Software (SAAS),Healthcare/biotech,Software (SAAS),Healthcare/biotech,Healthcare/biotech,PM,QA/Testing,Research,PM,Mechanical,Mechanical,Outstanding,Very Good,Excellent,Outstanding,Excellent,Outstanding,20,18,14,7,24,20,No,,Yes,Panda Rose,"Edmonton, Canada",AGFA Healthcare,"Waterloo, Canada",Seegene,"Toronto, Canada",Castor EDC,"Amsterdam, Netherlands",CellScale,"Waterloo, Canada",Spinal Simplicity,"Kansas City, USA","Good company, met my expectations","It was alright, some regrets though","Good company, met my expectations",Exceeded my expectations,Awesome workplace! Favourite Co-op.,Awesome workplace! Favourite Co-op.,"Partying, Playing board games/cards/puzzles, Watching movies/shows, Chilling with friends, Traveling, Hiking, Watching sports, Playing sports, Fishing, Woodworking, Gardening",>10 hours,>10 hours,>10 hours,"Intramurals, Orientation Week","BME, ME","Sweetdreams Tea Shop, Subway, Baba Grill",1,"High school, residence",8,9,8,8,7,8,9,10,6,9,6,9,7,9,6,7,6,7,6,9,,,"Graduate Studies, Full Time Employment","Graduate Studies, Full Time Employment, Startup",No,Yes,Yes,Spinal Simplicity,Kansas City,Product Design,NA; just working summer before grad school,0.5,Yes,No,No,No,Engineering Design (MS),Research,Masters,Pennsylvania State University ,Industry,Maybe,2 weeks,,No,Likely Caribbean ,15,Depends on how much money I end up making,26,"Kind, Confident, Physically Attractive, Similar Beliefs, Adventurous",3,2,"Money, New Experiences, More Interesting Job Opportunities"
